或许有人想成为他，但是多数人还是鄙视这种行为，能做出这个行为的无非的核心纽带就是利益，如果脱离了利益关系看这种行为那必然是无耻的，是很多人唾弃的。但是作为职场人谁又不是天天生活在这种环境中，自己单位的这种行为恐怕没有人敢这么大胆的说出来吧。每个人都是趋利避害的，当自己单位也有这个行为和这种氛围，我觉得能做到敬而远之就已经很不错了，有的人会为了利益出卖一些东西，有的人抹不下这个面子，不想成为那样的人，但是这个社会的利益分配方式恰恰将这种行为提到了非常高的一个权重，不参与的人要么甘于清贫，要么是被捧的一方。我就是那个既不敢指出身边这种行为不对的，又不愿意主动靠近的，不甘于清贫但是也不乐意做这种行为的人，在自己的环境不能说但是还能在网上说说这个行为的一个普普通通的职场老百姓，因为啥？怂，不得不怂，没有办法，自己被掐的死死的，不过也没觉得丢人，最起码没同这种行为一致，我觉得我的价值观是正确的，自己的内心没那么鄙视自己。或许被捧的一方曾经也是对方那样，因为付出的多了所以成功上位后希望自己也享受一下，甚至变本加厉，搞定乌烟瘴气。但是从社会共识上是鄙视这种行为的，这不就是封建余毒么，上主下奴，君尊民卑，为领导马首是瞻。发展到今天已经是人民当家做主，这样的行为是和社会体制格格不入的。每个人本来应该有独立的人格，正如罗所属被包养就失去了人格，这个经济利益关系本来是正常的价值交换，现在却附加了人格的不平等，或者也叫思想阉割，你不能拥有自己的思想，一切都要听从指挥，如果你不阉割思想，不阉割人格，不阉割尊严那就没人会给你生活所需。很多人被思想和人格阉割后想找个地方找回自己，这不是一个陌生的空间就成为了正常思想交流的乐土，我相信王某人在某个地方也会对某些一看就不合理的事情指责，不过是在自己所处的环境下的一种伪装，如果人人只有伪装起来自己讨得欢心才能换取生活所需那就是一种悲哀。小个体可见大世面，你在自己的单位不敢说不，对别人敢说，仿佛自己已经正义了。有的人经济独立了敢说不相干人的一些事，但是你如果再放大到一个环境中，有制约你的东西你还敢吗？人人都是一定程度的不得不接受阉割，没有办法，谁让咱要活着呢。,1,0,11,2023-11-16 11:15:13
质疑过不想理解也不想成为,1,0,14,2023-11-16 11:15:10
办公室里面有哪几种人？工作能力强 例如：销冠，技术大牛，少了他公司不是不赚，公司赚少了那是不行的，这种人老板也得尊重。普通员工 例如：公司里你不认识的张三，李四，这种只要领导钱到位，他也是很愿意尊重领导的。能力不强但是会拍马屁的 例如：综合办公室主任，这是个八面玲珑的角色。一般都会揣摩领导的心理。能力不强，干的也不咋样的  这种就属于可有可无。在我经历过的一个办公室，四个人（销售部主任  代理部主任  我 还有个老员工这里代称老张）销售部主任属于第一类人，代理部主任属于2或者4，老员工属于3 ，我属于2+1。有点自夸的意思，但是我当时确实干的很好，我属于销售部，负责的就是销售数据，还有业务的分派，这是个很奇葩的岗位，也很麻烦。但是自从我接任了岗位，至少领导总算有个好看的报告了。然后事情慢慢发生了，销售部主任干的好，终于找到机会升到省公司了，我本来还依旧干我的岗位，我胸无大志，习惯了也懒得改，但是新来的领导不一样，对很多事情看不过眼，就是新官上任三把火，老员工算是找到机会了。经过一番斗争，我被下放了，明升暗降，这事情我是实在不爽的，索性辞职走人。老员工也没落的好，没得能力，德不配位，没干几天，就被换下来了，结果是我徒弟上位。事情过了这么多年想想，我要是会拍马屁，那肯定是不一样的通道。,1,0,0,2023-11-16 11:13:48
社会本就是个大染缸，但把这些个别言论说成是当今职场风向还是不合适的。这个世界的人本就各种各样，每个人都有自己的价值观念，我身边也有不少不为斗米折腰的人，年轻为单位贡献青春，中年又为家庭尽责，这才是咱们文明能延续的骨干，只是他们大多选择默默无闻罢了，即使做了点贡献也不愿意张扬。,1,0,1,2023-11-16 11:13:24
土味情话其实私下里说说就行啦，非要公开说就有点问题，毕竟是在公司层面。另，罗永浩yyds，我是老罗骨灰级粉丝,1,0,2,2023-11-16 11:13:01
这就是中国媒体，张雪峰牛逼，中国媒体确实能说出这种话,-1,0,33,2023-11-16 11:12:37
如果有这样的机会，谁不想呢,1,0,0,2023-11-16 11:11:58
他说的没错，职场快速进步的方法，还就是靠近领导。当然了，道理是这么回事，只不过他表达的语句，听上去很暧昧，充满了一种情愫在里面，缺少了对领导那种发自心底的敬重，多了一些情深深雨蒙蒙的感觉。好像生怕对方不知道，生怕别人不知道：我的眼里只有你。普通人的话，靠近领导，然后敬重领导就行了，至于说还抱着什么杂七杂八的想法，想要突破上下级关系，实现你侬我侬地境界，我觉得完全没必要。这是糟粕，我们应该坚决摒弃并制止。,1,12,73,2023-11-16 11:11:43
1、读十本书不如跟随一个导师级的人物一段时间，这是古人都说烂了的道理。任何一个人，让你在任总、董总、马总......身边工作一段时间，你不觉得是天降大运？我都七十了，哪位老总让去给他当秘书，我一分钱都不要，就是想见识见识、学习学习、检点失眠！2、至于那些绯闻，没见拿出证据来。吵的有什么意思？3、公众人物就不能有私生活？4、董明珠看着王自如说话的表情也很好理解：老汉现在看见年轻人就高兴，看着小孩子就更高兴，如果他们表现的挺好还高兴得不得了......这是上了年纪的人看着年轻人正常的心态！5、多几个角度看人看事，不要极端思维、线性思维！,-1,0,1,2023-11-16 11:11:41
儒家几千年的东西，一两代人怎么改,0,0,0,2023-11-16 11:11:09
某A升了职，成为了团队的主管。同级某B虽然表现得很得体，又是恭喜又是支持的，但是转过头还是忍不住吐槽，说某A的这个主管还不是拍马屁拍来的。适当的马屁确实有助于升职加薪，不用表现清高。当然不一定非要成为王自如，有自己的会办事的方法就行。会办事的人，首先是和上司间存在有效沟通。刚毕业的小领导在我眼中也是一个“马屁精”。一到了部门领导要给我们各个小组派任务的时候，领导总要去大领导的办公室里聊一会儿，进去的时候笑容满面，出来的时候荣光满面，接下来我们组的任务总能最快完成、得到大领导的认可，返工也非常少。这让我们一致认为是领导拍对了马屁。而事实上，在后来的相处中我才明白，领导那是在和上级沟通任务。从一系列工作的要求、重点分布、期待的效果，到上级的思路、想法。领导一点点和他沟通完毕，我们小组就能更加精确地把握到重点和关键，高效率就是自然而然的了。会办事的人，会的是周旋在职场人和事中的技巧。如果你接受了领导布置的重要任务，紧赶着要完成，可是同事们有工作要找你帮忙，你会拒绝还是接受？其实大多人心里想要拒绝的，毕竟专心做好自己的工作是关键，尤其这是领导亲自安排的。而别人的事情说到底功劳也不会属于自己，如果顾此失彼反而自己遭殃。但是，心里想是一回事，真的放到现实中，恐怕你会因为不懂得拒绝、不懂得平衡而答应了别人的求助，结果自己忙得找不着北，两头不讨好。那些在你眼中会办事的人，则大多懂得分清轻重缓急，该拒绝的时候就拒绝，哪怕被周围人误会是领导的“跟屁虫”，都不以为意，毕竟职场上最重要的还是完成工作本身。会办事的人，明白的是适当表达自己的困惑和求助。我还在上家公司做研发的时候，常常是一份工作没做完，领导就扔了新的过来。但我旁边的同事和我差不多的工作量，他从来没有被追加过任务。当我忙得团团转时，他倒提交了任务去领导那儿聊天沟通了。这大概就是会拍马屁的那种人，我当时想。但是没多久那位同事好心提醒——如果你做不了，就该适当让领导知道，而不是一味沉默，领导还以为你乐得做这些呢。这句话如醍醐灌顶，他又和我分享了如何委婉避开被多委派工作的方法，比如多向领导汇报工作进度、多提问如自己应该在多久完成XX目标等，甚至多提问也是一种不错的方法。会办事的人，懂得如何获得更可靠有效的支持。工作中想要获得成功，领导给你的支持也是很关键的一项。如果你能争取到领导的好感、争取到他各种资料、客户源、信息的支持，那自然事半功倍。所以很多时候我们争取领导的好感，为的还是自己的工作。一个和谐的工作环境、相处融洽的人际关系，肯定比彼此故作清高、不肯退让的僵持要好得多。只是让你对领导和颜悦色一些、对方说的一些废话稍稍附和一下，然后你就能有更好的工作环境和底气，有何不可？很多年轻人别说对领导表现出尊敬了，哪怕是见到领导笑一笑、打声招呼都不乐意，最后倒霉的还不是自己，毕竟职场残酷，能争取到多一分就多一分脱颖而出的可能。适当地“拍马屁”，其实是一种工作中有效的、积极的沟通和交际方式。别一味地保持着自己无用的“清高”，却连最基本的工作都做不好。,0,0,8,2023-11-16 11:10:55
既然被（划掉）包养，就不要说人（划掉）格独立。老罗的话是听进去了，但没全听远远不是什么年轻人的出路独立之思想，自由之精神，强健其体魄才是,1,0,0,2023-11-16 11:10:39
我觉的媒体也是在人性负面道路上越走越远了都说自媒体为了出圈，无底线的去挖掘或者编制新闻而你看这正儿八经的媒体，还不是找一些有话题的人利用人性的弱点，找一些有话题的人来不断的深挖期待一些爆点可以引发社会的关注完全不顾这个人物是正面的还是反面的 只要是能引起争论，就是他们的成功那么这样和自媒体想出圈有什么区别？,1,0,0,2023-11-16 11:10:39
质疑自如，理解自如，成为自如，伸缩自如,0,1,0,2023-11-16 11:10:20
大家不要骂了，他已经听了罗永浩的话了。罗永浩：如果你是被包养，就不要谈人格独立。完美。,1,0,0,2023-11-16 11:10:19
新闻学扣一百分,-1,0,0,2023-11-16 11:09:30
钱难挣啊，不管咋样，有钱才是硬道理。,-1,0,0,2023-11-16 11:09:16
简单点说王自如这个人，再被老罗卖手机battle被爆锤以后就只走一条路黑红，他也是红被讨厌、被骂，也是有流量的（like 张大大）三星跪舔、格里跪舔等事件已经表明了人家知道怎么把黑红流量变现他的消费人群不是咱们这种天天在网上鄙视他的这些人而是那种你生活中一定有的，凡是都给你杠都反驳你的，觉得自己只要不随大流思想就一定正确的人这种人老百姓群体有、精英群体也有只要他有变现手段，又自带流量，那么他被大企业用，就是无可厚非一件事如果你不信，请你听 以下言论：罗永浩直播间聘请格里高层王自如亲临直播间我就问这标题你看了，你想去那直播间看看不？即使就是进去骂两句，你想去看不？你好奇不？,1,0,5,2023-11-16 11:08:48
TAG：TrackManException --> 请发送给@YuKaiRui.........../versionName: 9.27.0-beta; versionCode: 28509; phone: Xiaomi.........../java.lang.IllegalArgumentException: Expected URL scheme 'http' or 'https' but no colon was found	at okhttp3.HttpUrl$Builder.parse(HttpUrl.java:1287)	at okhttp3.HttpUrl.get(HttpUrl.java:917)	at okhttp3.Request$Builder.url(Request.java:220)	at com.zhihu.android.adbase.tracking.oldtrack.TrackerMan.execute(TrackerMan.java:91)	at com.zhihu.android.adbase.tracking.oldtrack.TrackerMan.execute(TrackerMan.java:54)	at com.zhihu.android.adbase.tracking.oldtrack.TrackerImpl.lambda$send$0(TrackerImpl.java:219)	at com.zhihu.android.adbase.tracking.oldtrack.-$$Lambda$TrackerImpl$clvSQosK7PlFBVkTAwM4SxagYhM.run(Unknown Source:2)	at java.util.concurrent.ThreadPoolExecutor.runWorker(ThreadPoolExecutor.java:1167)	at java.util.concurrent.ThreadPoolExecutor$Worker.run(ThreadPoolExecutor.java:641)	at java.lang.Thread.run(Thread.java:920)	at com.zhihu.android.ai.a.d.run(RulerThread.java:101)...........,-1,0,1,2023-11-16 11:08:13
10:57:01【深成指跌逾1% 下跌个股近3700只】财联社11月16日电，指数走弱，深成指下挫跌逾1%，沪指跌0.62%，创业板指跌1.49%。光伏、半导体芯片、医药医疗等方向跌幅居前，两市下跌个股近3700只。10:04:11【创业板指跌逾1% 下跌个股近3200只】财联社11月16日电，指数走弱，创业板指下挫跌逾1%，沪指跌0.44%，深成指跌0.67%。光伏、房地产、医药等方向跌幅居前，两市下跌个股近3200只。,1,0,0,2023-11-16 11:08:13
格力员工的感触应该是最深的，他们应该幡然醒悟了，原来自己一直没有升职加薪是有原因的，原来老板喜欢的是这样的人。,1,5,34,2023-11-16 11:08:11
今天的知乎热搜是怎么了？聊年轻人的出路是么咱们不如聊聊这个吧，至少这个是真靠实力,-1,0,0,2023-11-16 11:08:05
看主流媒体们正在向社会、向民众、向年轻人传播什么样的价值观，体现了这个国家的高层、起码是宣传主管部门的高层们所具有的价值观与道德观。,0,0,0,2023-11-16 11:07:54
逐帧学习,1,0,0,2023-11-16 11:07:15
如果是格力自己买的热搜：一个企业得堕落成什么样才需要靠着炒作实控人和小白脸来搏流量如果不是格力自己买的热搜：一个企业得堕落成什么样才会出现企业内实名求包养工作环境散发着摇尾乞怜的恶心求爱气味他们在工作？如果实控人和下面的面首都没有工作，那么谁工作？没人工作，格力还没死，只能说明是血厚，死的慢,-1,0,0,2023-11-16 11:07:07
他虽然一度得到自己想要的东西，但过得未必是他想要的生活。,-1,0,0,2023-11-16 11:06:54
大家心态放平，我觉得王总这不是跪舔，这特么明明是趴舔，从脚趾头开始舔,0,0,1,2023-11-16 11:06:21
质疑，成为，理解,-1,0,0,2023-11-16 11:05:55
罗永浩名言在10年就已经预测他的结局 被包养就不要谈什么人格独立,1,0,1,2023-11-16 11:05:45
我觉得利益不应该是人的唯一追求。这个想法也许有点天真，但人之所以为人，总该跟为了一口吃的就摇尾乞怜的动物有点区别不是吗？当你为了所谓的阶级跃迁而违背本心地攻讦或谄媚他人时，你还是你自己吗？如果爬得更高的代价是失去自我，那么爬得更高的意义是什么？是财富或者地位？可在生命有限的情况下，财富和地位最终都会化为虚无。金钱给人的底气是自由，自由的本质是自我，人拼命追求的一切不过都是对自我的认可。既然如此，用放弃尊严的方式换取被认可岂不是本末倒置？诚然，现实里充满不公和诱惑，人总要面临种种压力和不得已，我不会指责王，但我永远尊敬那些坚守自己底线的人。,0,0,0,2023-11-16 11:05:40
理解个屁，成为个屁,0,0,0,2023-11-16 11:05:09
不就是当年被老罗在直播间怼的说不出话那位嘛,-1,0,0,2023-11-16 11:04:52
吃软饭还吃的那么理直气壮？在古代赘婿和商贾是一样的待遇，在战争的时候要强行服劳役，打仗的时候要作为敢死队第一顺序冲上去做肉盾和箭矢消耗品。,1,0,0,2023-11-16 11:03:32
质疑他，不理解他，不想成为他…仅代表自己,-1,0,0,2023-11-16 11:02:45
媒体评论没啥用，还是把选择权交回给年轻人吧。,1,0,4,2023-11-16 11:02:42
“既然被包养，就不要说人格独立。”罗老师不愧是罗老师，王自如的职业引路人。,1,0,1,2023-11-16 11:02:31
到这个级别了，人际社交处理能力远大于个人能力，而工作手下人来做。王自如和雷军关系很好，但是不如之前好。我看到一个回答说，王自如三寸不烂之舌的忽悠，其实王自如和罗永浩的辩论，属于彻底输了，所以王自如不善于忽悠，但是抓住了时代的机遇。王自如在董明珠面前非常的真诚，掏心掏肺，而这洽洽是董小姐看中王自如原因。,-1,0,0,2023-11-16 11:02:24
晕！我一直以为大家讨论的王自如是说脱口秀的，我还纳闷一个说脱口秀的怎么会和董明珠放一起讨论，这也不搭啊，刚才查了一下，原来被我误会的那个叫“王自健”，真是对不起啊王自如和王自健。,1,0,1,2023-11-16 11:02:06
想在笑自如 怎么没人说明珠呢,-1,0,0,2023-11-16 11:02:04
哈  我觉着媒体是在宣传年轻人要向比自己优秀的职场人学习在职场中能够碰到优秀的前辈是多么难得的事情跟她们聊天年轻人可以学到很多自己不知道的工作方法学习她们成熟的处事方式学习她们的职场经营通过她们的谈吐增加自己的见识扩宽自己的视野 我觉着这是件好事这样的前辈运气好了遇到 能够快速提升自己可以让年轻人快速成长,-1,0,0,2023-11-16 11:01:15
我不想成为这样的人，但要活着就必须是这样的人。除非你是某方面的天选，或者你的父母是天选。不然你总要舔，无非是舔的对象不同。不过世界本就如此，弱肉强食而已，无非有的强者，有的时候愿意施舍一些善意。因为他们有选择，而大部分人，没有。,1,0,1,2023-11-16 11:01:11
哪个靠舔狗上位的混蛋，教年轻人怎么舔？难道是舔他们？怕自己舔道没人继承,-1,0,0,2023-11-16 11:00:39
新闻专业果然XX，抄梗都不会抄。完整版是：攻击自如，鄙视自如，质疑自如，理解自如，（妄图）成为自如，不如自如，羡慕自如，嫉妒自如，攻击自如,1,0,2,2023-11-16 10:59:28
知乎，B站，抖音，但凡涉及到一些大龄富婆底下那都是一片什么姐姐，宝贝，颜值，身材还活的去的，那更是什么话都出来了，论谄媚是不输王自如半分的吧，这说明想吃这碗软饭的人不说10个男人里有9吧，至少也有4，5个，付出实际行动的虽然百不足一，但是也不至于今天看到一个就要置之死地的辱骂吧。男人应该理解男人，人家只是不想努力了，不想996了，不想给资本家剥削了有什么错。,1,0,0,2023-11-16 10:58:39
如果人人都像他这样，这样才是这个国家的悲哀，这个国家也彻底不会有希望了,0,1,0,2023-11-16 10:58:32
我在抖音上也刷到过关于他的视频，我现在的状态是质疑他，但我感觉至少现在的我做不到理解他，更不会成为他。2023年11月16日。,0,0,0,2023-11-16 10:58:05
看到这个问题其实还算是很欣慰的至少对于当下的刚出社会不久的年轻人居多的这个平台能够把这个问题摆上台面讨论在当今的话语氛围内还是不容易的了,0,0,3,2023-11-16 10:57:49
牛逼,-1,0,0,2023-11-16 10:56:59
吃软饭 贿赂官员 舔 外加一点点运气 才是现代人要学习的。从幼儿园到博士都是这样的,0,0,1,2023-11-16 10:56:40
为什么要成为他。。。单说世上有几个明珠？工业皇冠上的明珠都快没了。,1,0,0,2023-11-16 10:56:01
很多人看不上王自如，只不过还不自知，大部分还不如他你说他被抱养，假如这个前提成立，那你在任何一个不能甩手就走的企业，是不是还不如他？至少人家还对自己的处境很满意，你呢？,1,3,1,2023-11-16 10:55:47
能让董小姐拉丝的人，王ok算一个,1,0,0,2023-11-16 10:55:29
嘲讽归嘲讽，王自如绝对是人生赢家，这个毋庸置疑。但是，“能不能给我一间离你比较近的办公室，我要随时向您汇报”这句话真是和我见过的有些舔狗说的话太像太像了！以至于我看到王自如说这句话，脑子中立刻浮现出那几只舔狗的样子和他当时说那句话的语气和神情。生理性不适！,0,0,1,2023-11-16 10:55:19
反应了媒体在迎合一部分虚无主义人群。,-1,0,0,2023-11-16 10:55:16
过度解构之后，就会进入这样一个死循环。媒体向来是无脑跟风的。质疑-理解-成为这种口水逻辑就慢慢流行起来了。至于反映什么社会现象，只能说大家都很闲。就像我现在偶尔要靠胡乱在知乎上写几笔回答来打发无聊一样。,1,0,0,2023-11-16 10:54:57
熟悉的剧情：质疑，理解，成为。结果呢？结局是相当感人了,1,0,0,2023-11-16 10:54:57
董王又有新宠了？那阵子不是有个秘书啥的吗，别管啥角色，都只是董王的流量工具而已，这个年代了除了老板都是螺丝钉,-1,0,0,2023-11-16 10:54:12
靠嘴吃饭没什么可耻的，反而是这个自媒体记者蹭得难看。,1,0,0,2023-11-16 10:53:55
干自媒体有啥前途啊？成则马前卒，败有王自如。是不是瞬间燃起来了？金字塔顶，想都不敢想啊。,-1,0,0,2023-11-16 10:53:51
说明了听人劝吃饱饭。老罗很明显在当时就说了，想要被包养，就记得抛弃独立人格，而王自如的采访和成就也充分说明了他真正的理解了老罗的话，大部分人是做不到这么全心全意抛弃独立人格的，这人从各种角度上将都很厉害。而不是跟一群乐子人一样就玩个文字梗。,1,0,0,2023-11-16 10:53:48
-这本身就是个伪命题！ 媒体评论的主题声可不是这，是 口含** 进退**、GL嫪毐，这种人就是企业的蛀虫、社会的毒瘤；做企业没有道德底线；去了企业就是可劲跪舔，可劲蹂躏下属。想想这种人哪个倒闭的企业没有，你要误导民众学习他吗，社会已经够遭的了 做个人吧！你就不怕以后看到家里的空调 膈应吗？！！！,-1,0,0,2023-11-16 10:53:40
大腿也不是想抱就能抱的，富豪可能不是最聪明的，但绝对不蠢。能被看上的舔狗自己也是有两把刷子。多数人是没有舔的机会，有的话舔的比谁都快。人脉即是钱脉，经营关系远比经营自己见效快，这早就流行起来了，只是现在更明显而已。口含明珠，伸缩自如，成了流行梗，无法直视了。,1,0,0,2023-11-16 10:51:58
口含明珠，来去自如,1,0,0,2023-11-16 10:51:37
想要造新神造谁不好，非要造个王自如？潜台词就是所有质疑他的人最终会成为他，你这媒体评论能代表谁啊？还能反应社会现象了？,1,0,7,2023-11-16 10:50:02
张雪峰再加一分,1,0,0,2023-11-16 10:50:01
