王自如这也是一种通透啊，原来的创业就算再成功，天花板也不高，而进入格力有机会获得更多的成长，而更快的成长路径无疑是离领导者越近越好，将来或许有机会成为高管甚至领导者，中国的很多企业终会成为世界级的企业和品牌，这是凭借一般的创业根本无法达到的。,-1,0,0,2023-11-16 13:52:05
自如舔珠,1,0,0,2023-11-16 13:51:20
我曾经写过一篇关于“向上管理”的回答。在回答中，我告诫大家千万不要抖机灵，随意对领导使用向上管理，因为效果根本不大。首先，你“管理”的领导级别不够，你根本从他身上拿不到结果；其次，高级别领导火眼金睛，不上你的套；第三，领导若是讨厌你，越“管理”反而越糟糕；第四，能把领导管理成功的大神，有一半原因是领导情愿被你“管理”。今天，通过王自如老师的采访言论和拿到的结果来看，他就是把向上管理玩得炉火纯青的那个人。董佬是个什么人？营销出身的女强人，在女性的晋升空间本就比男性要窄的职场上，她取得今天的成绩，足以证明了她的强势、手段、经验、看人能力已经超出常人。而王自如，能把她管理了（或者说她心甘情愿被管理），可见他又是什么道行？说实话，初看，质疑他，第一次听完他的言论，内心不由得感觉这马屁拍的无人能及。但冷静过后，对标自己，同样都是跟在领导身边（级别还比董佬低），自己就想不到，做不到。后来我认识到，这不是意识的缺失，就是能力的短缺。所以，我能做到理解他，但是成为他这个事，我对自己没信心！也许是我天赋太差，也许是我腰间盘突出，弯不下。最后，结合王老师的案例，再看我这篇文章，大伙就说我当初写得对不对吧！以下是文章部分截取：一、关于“向上管理”几乎每位职场博主，都曾告诉过大家，在工作中，一定要对领导实行“向上管理”。但，其实“向上管理”这玩意，门槛太高，限制太多，一般人根本玩不转，如果你道行不够，我劝你趁早打消向上管理的念头。向上管理说得通俗点就是：打着官方的旗号，为自己拿结果。拿什么结果？无非就是升职、加薪。那升职加薪的权利掌握在谁手里？无疑是公司的头把交椅。这也就说明了，级别越高的领导，越值得你做向上管理。类似于基层班组长，小主管之类芝麻绿豆的小官儿，你管理他的目的无非也就是，让自己的打工生活过得舒服点。你肯定不会妄想他把你也提拔成小组长，你也知道，他没这个本事。我在央企工作近8年，从基层的无职级的经理，到省公司一把手，我都和他们工作过，我总结出一条规律：职位越高的领导，越难做向上管理；职位越高的领导，越值得做向上管理。这个理论，听起来很矛盾吧，这也恰恰是我不推荐大家做向上管理的原因。1.向上管理的难点：高级别领导，火眼金睛。我在上文说了，向上管理的本质就是，通过揣摩上意，投上所好，引导领导按自己的意图去做事，从而拿到自己想要的结果。这看起来并不复杂且功利性十足的目的，你认为领导会不知道么？你去问问能被领导称之为心腹的人，哪一个在工作中敢和领导玩心眼？北海从做秘书的第一天起，就已经放弃了向上管理的念头。因为，领导当初跟我聊，说选我这个经验尚浅的小孩儿做秘书的原因是：他在我身上看到了年轻时的影子。就这一句话，我几乎就可以断定，在以后每个阶段，我脑子在想什么，他应该都能够看得出来。所以，我服务领导的原则就是：真诚。想要什么，不想做什么，直接表达，不跟领导耍小心思。因为，领导也是从这个阶段走过来的，而且他所见所遇所历，要比我们丰富得多，也复杂得多。所以，面对高级别领导，别轻易“炫技”，盲目的去使用向上管理。2.使用“向上管理”的前提：领导不排斥你。一个人，无论多么的出类拔萃，多么的双商在线，也总会有领导，不喜欢你。这时候，你的能力，在领导眼里，是刻意炫耀；你的高情商，在领导眼里，是狡诈，虚伪，不实在，你所引以为傲的一切，在领导眼中都是槽点。而此时，你的向上管理，你的投其所好，领导会把其归结为“算计”。你贴的越近，想得越深，管理得越用力，领导就越是提防你，越是想推开你，也会更加讨厌你。而有些人引以为豪的，向上管理的成功案例，都逃不出一个定律：领导喜欢你，情愿被你管理。如果你遇见一个领导讨厌自己，那北海劝你，自觉退下，因为你越是想通过“管理”来改变领导对自己的固有印象，情况反而越糟糕。3.“向上管理”的成交条件：双向奔赴只有在领导愿意被你管理的时候，你的向上管理才会成功。而一旦他翻脸，任何方法都将没用。举个例子：做好领导的目标管理。比如，领导要求你做个方案，三天上交。你通过事前请示-事中汇报的方式把项目的难点反馈给领导，让领导了解到三天确实难做出高质量的方案，于是领导同意将方案上交时间延长至五天。-管理成功但是你有没有发现，领导同意的前提是：要上交更高质量的方案。-成功条件也就是说，你付出的过程更多了，他才愿意让步。如果五天之后，你的方案很烂，那他会更严厉的批评你。但如果，他不接受你的提议，仍然坚持三天内上交方案，那你也得必须完成命令。-管理失败可是你在与时间赛跑赶进度的过程中，方案的会质量可能会有所下滑，这也是他必须所承受的。简言之，你接受他的不让步，他接受方案的质量下滑。-失败交换假如这位领导两头堵，那就不是管理，而是纯粹在刁难你，逼你离开。其实，换个角度想，这难道不就是我们所理解的“各取所需”-你提供领导价值，他提供你想要的。也许，这才是适用于普通打工人与领导相处的方式。通过这个例子，我们不难发现：当你所提供的价值越高，实现向上管理的几率越大，但前提是“你的管理”没有超出领导的预期底线。如果你很轻易的实现了向上管理，说明两个现象：一是你的能力已经从“侍上”进化为“弑上”；二是你的领导的职位和段位真的很低。所以才会轻易被你“遥控”。（当然也可能是你亲爹或者亲老丈人）。,1,3,26,2023-11-16 13:47:56
希望《完蛋》游戏组出新dlc，把钟甄换成董女士，我练习练习,1,0,0,2023-11-16 13:46:01
其实人际关系很简单，不过是国际关系的缩影。在职场里，权力既来自于职称，这是法理权威，也来自于和权力中心的距离，比如最经典的就是决策者的顾问群体。首先，在一个几万人的大企业中，决策者需要大量管理层，那么必然会组成派系，为了制衡和安抚各方，会把一些部门通过人事给到这些派系，所以职称选中的人，那些各个部门的部长未必对决策者言听计从，于是决策者需要自己的顾问团体来给自己出谋划策，这些顾问距离决策者很近，他们的话能影响决策者，所以权力就会很大。各个部长的任务就是把决策者的意志转变为可以完成的KPI交给下面的人，但决策者的意志是受到顾问影响的，即便最后拍板的人依旧是决策者自己。其次，各个部长在他们部门也是决策者，下面的人可能是某个领导的亲戚等等各种原因无法掌握，也需要人当眼线来保证自己可以把握这个部门。所以这些人可能会在短时间内深受领导喜爱并且飞黄腾达，成为同事们羡慕的对象，但是不是年轻人的出路这一点我表示质疑。企业能发展肯定不是靠谄媚的人，而是一大批脚踏实地的领导和员工，这些人是企业发展的基石。我说句不好听的话，这些人是企业的栋梁之才，也是需要天赋和实力的少数人，大部分人也只是企业的螺丝钉，换着也的确很方便，所以在这些螺丝钉里，谄媚的方式方法可能是最快的，但风险也是很高的，毕竟是拍马屁嘛，你得拍的最好才有留下的理由，毕竟一个领导不需要一班子人拍马屁，他的刚需是一班子脚踏实地的员工,1,0,0,2023-11-16 13:37:34
世事洞明后面还跟着一句，人情练达，这就是方法论。一边是生存日趋内卷的普通人社会，一边是资源高度集中的上层世界，好坏的争议且搁置，对错似乎也不是当代人能左右的，年轻人但凡有一颗不甘凡庸的心和一份破圈跃层的骚动，如果你不是爷叔这种有着钢铁一般意志的男人，遇到大佬却还放不下身段去舔，似不似傻？,-1,0,2,2023-11-16 13:37:32
大概是在4、5年前，那时候初出社会，我觉得我就算成为不了世界首富，那也应该是个小有名气的富翁家，至于软饭？真不熟。后来经过社会一次次的鞭打，我发现我就是一个普通人，在游戏里面的话甚至不是一个NPC，只能算是一个拖主角团后腿的村民；我不仅做不到富翁家，就连活着也要用尽全力。现在看到吃软饭、装傻充楞的人，我会觉得这人肯定有我不知道的长处，这世界上除了智力有缺陷的人，没有谁是傻子，如果有，那就是把别人当傻子的那个人。普通人，一样可以活的精彩。其实我们每个人的生活都是一个世界，即使最平凡的人也要为他生活的那个世界而奋斗。  —路遥,-1,0,2,2023-11-16 13:37:20
“质疑他、理解他、成为他，才是出路么？更深一层的思考是：难道掌握了这些套路方法就能打通上升通道，还是学到了这些仅仅只是一个最基本的职场要求而已？”我也是一个理想主义者，内心从拒绝“王自如”到理解，“王自如”是一种能力，软实力，应对职场的软实力，被国内社会、职场毒打两年之后，慢慢能理解了，但是确实也还不具备，所以还在挣扎。依然觉得，还是要问问自己要什么，职场上需要就学一点点，别带到职场外，职场外想怎么做自己就怎么做吧，年轻就是资本，错不可怕，可怕的是回首觉得自己没活过，对吧。,0,0,0,2023-11-16 13:32:04
2013年雷军入选央视的年度经济人物。当天在晚会现场的后台，编导希望让雷军和董明珠能活跃一下气氛、热闹一下，“你们看去年马化腾和马云打了个赌就热闹了一年”。雷军领会了导演的意图，就提出“董总咱们也打个赌吧，就赌一块钱，赌五年后我们企业的营业额！”当时，格力的营业额是1000亿元，小米是200亿元。董明珠同意了。但让雷军没想到的是，董明珠一上台就直接开口要赌十个亿。当年这个新闻，作为看客的我：对雷军是不屑的，觉得雷军就是做营销的，就想吸引眼球，就想爆新闻，求关注，求流量，产品就能样，怎么能和国货之光的“好空调、格力造”相提并论呢？我那时候觉得，以后买房子装修时一定用格力空调，美的都不考虑。但是后来我装修的时候，不仅仅空调用了小米的，电视等很多家电都买了小米。而今天看到这个新闻：十年过去了，小米做出了生态。而格力竟然需要靠炒作话题、制造热点、牵手网红来刷存在感了？真的让人感慨世事无常，造化弄人呀。大家都在讨论王某人：说实话我不了解他，也不关注他。只是很好奇，小孟的热点刚刚过去，格力立马又造一个热点出来，不知道下一个热点会是什么？难不成是王某人离职，哈哈哈哈格力这个IP还是有流量的，但是如果出圈的话题总是和产品无关，这种出圈到底是“幸”还是“不幸”呢？@知乎职场 @知乎家电 @知乎商业资讯 ,1,1,55,2023-11-16 13:30:42
年轻人肯放下身板，低下头去做事，真是前途不可限量这才是大家该学习的典范出身寒门不是耻辱，能屈能伸方为丈夫。就像祁同伟一样，向自己最痛恨的人屈服，这种决心不是谁都能下的。迎合当权者，这是不变的规律。刘繇王朗，各据州郡，论安言计，动引圣人，群疑满腹，动难塞胸，今岁不征，明年不战，使孙策坐大，遂并江东。,1,0,2,2023-11-16 13:30:30
奋斗逼嘛，这有啥奇怪的。上面那句无贬义。每个人都有选择自己生活的权利。我既不理解他，也不会成为他。单位有个没背景、奋斗逼但是不作恶的哥们喝多了说我，你是傻逼。我说，我以少挣钱、慢升迁甚至不升迁为代价，换自由的时间陪老婆孩子父母亲人、娱乐自己，我觉得值。我其实还有半句话想说，但我没说，怕打起来。那半句是：我就怕奋斗了一辈子，职务职级也在升，结果最后发现跟人家拼爹族比起来，屁都不算，回头看看家庭老人孩子都没照顾好，我承担不了这种人生目标崩塌的打击。所幸我的前半生还算可以，虽临不惑但始终没放弃生活，也算能力强的那一挂，多少还能得到领导赏识。当然，我也遇到过尸位素餐的领导，怎么办？躺平、配合、尽快送走他，必要时还要抬他一步。遇到奋斗逼领导怎么办？发扬甘地精神，配合工作但不配合作息，吃哥们饭不吃应酬饭。大多数奋斗逼不会针对配合工作的人。当然，前提是你要够硬，最好能在大领导那挂一号，或者比奋斗逼来的早之类，如果这些条件一个也不满足，要么追寻自由要么削足适履。但奋斗逼带的队伍是最难呆的，委屈自己他都不会领情。小时候我的台灯上有8个字：知足常乐、能忍自安。我极端同意前半句，极端不同意后半句。我坚信人生是由选择堆砌起来的。我说王自如是奋斗逼，不含贬义；我自称傻逼，同样不含贬义。像我喜欢的电影『黑客帝国』里先知说的一样，人生很多时候“你已经做了选择，你得弄明白你为什么做了这样的选择，并且接受它”。这有点唯心，且主观能动性不强，但有时候就是如此，和平国家普通人的生活暂时不需要我去“人定胜天”，我要是生在加沙，没准会成为个“精英恐怖分子”啥的也说不定。总而言之，我就像很多普通而平凡的中国人一样，在本职岗位上做本职工作，甚至很多时候还会做得比其他人更好那么一点点，我挺高兴这样。我觉得，历史是由我这样的人一起书写的。,-1,0,2,2023-11-16 13:29:08
你们知道流量有多贵吗!在四处都是抢人抓人眼球的时代，能够免费获得这么多的流量——要说王自如对董明珠的懂，这是他最懂的地方。请参考原先的孟羽童。精明不过董明珠!又宛如大强子炒奶茶!你我等拿着别人零花钱的年薪（可能还不够），操着别人跟自己八竿子打不着的心。,-1,0,0,2023-11-16 13:25:34
反应了什么社会现象不敢说，只敢说一些我看到的事实。职场上所有人都算上，私下里鄙视其他人阿谀奉承的人都是马屁拍到马腿上的人。他们比谁都想拿到好处，又废又怂嘴还碎。我在职场第11个年头，从未说过一句类似某某人巴结人这种八卦，因为我深知一个人的语言无论如何包装其实都可以完全对应ta的心态，ta想要的因果，所以哪怕一个想要靠自己的嘴甜往上爬，那么起码也在努力想办法解决自己的问题或者达到自己的目的，暂时没拿到嘴甜好处的可能是洞察力不够或者太过于言过其实。而且嘴甜大概率是锦上添花的，雪中送的炭还是要及时一些才能令嘴甜更有意义。现代职场人没什么可抱怨的，有办法的请拿出办法，没办法的请闭上嘴少哄抬职场负能量。至于质疑谁，理解谁，成为谁，这恰恰是一个人的成长轨迹。再无其他。褒贬都是释放情绪，谁在解决问题？,0,0,0,2023-11-16 13:24:31
虽然我笑他笑得很自如，但我其实活得没有他自如，所以我必须要自如地笑他，人生自如则无敌。,1,0,0,2023-11-16 13:24:06
没看过工资条？这个已经超出了正常态人类的境界，万一只有两毛五分钱，继续微笑么。质疑？没有的，只有困惑和不解。想当年也算一条汉子，怎么如此娇柔模样。理解？D姐给几个亿才能配得上这份“理解”。成为？都是五斗米折腰，但确实没有如此大张旗鼓仰拍领导的骨气。只有感慨，大千世界历练出了百样人生。,1,0,0,2023-11-16 13:18:14
王自如是有能力的人，这点毫无疑问。王自如无论智商和情商都很高，这个点也毫无疑问。当众跪舔董小姐会被群嘲、会被看不起，他知道吗？当然知道。他在乎吗？不在乎。他真的打心眼里崇拜董小姐吗？未必。所有的一切，不过就是为了所谓的“成功”。我们这个社会，总有人为了钱不要脸，但不要脸了还要公开宣扬、那就必须要被唾弃。P个S，我不认为董小姐有什么问题，用人用其长，大企业家有大胸怀，鸡鸣狗盗皆可用，但鸡就是鸡，狗就是狗，舔就是舔。,0,0,2,2023-11-16 13:15:59
“我没有看过格力给我的工资条”“能不能给我一间离你比较近的办公室，我要随时向您汇报”“我哪怕每天什么事都不干，我就看她怎么开会，我听她每天讲什么、做什么，我都觉得是一件很幸福的事”“刚毕业的年轻人一定要学会心态归零”……质疑他、理解他、成为他，才是出路么？成为“中年王自如”之前这些关于人生的大哉问，王自如自己可能也曾有过。故事的开始大概是这样的：生于黑龙江齐齐哈尔的少年学霸王自如，凭过硬的英语成绩跳过初中直升高中，再由西安翻译学院跃至香港理工大学，迈出了看世界的两大步。在香港，王自如买下人生第一台Mac，虔诚而细致地做了一期开箱视频。视频难免生涩，但他的热情感染了彼时同样单纯的数码爱好者，这则视频也成为他十年评测创业路的开端。做评测头两年，王自如自费购置数码产品，据称花费了30万港元，还背上了20万港元债务，一度穷得不敢打车，甚至不敢喝饮料。物质上的拮据与精神上的富足在这一时期的王自如身上共存，他也借此收获了第一批同样痴迷于数码文化、欣赏其锐气与才华的关注者。他有了被同龄人仰望的理由。其后，王自如辞掉香港的工作，将Techmessager改名为ZEALER，带着几位出身各异的伙伴，在深圳的一层平房里开始创业。凭着数码产品的认真探索和分享，ZEALER在数码评测的大航海之旅中劈波斩浪，搞内容、定标准，迅速博得名声。2014年对王自如和ZEALER而言是重要的分水岭。王自如先是开了ZEALER 2.0发布会，试图为评测行业订立一套全新的高标准，赢得关注与赞誉；随后便发生了尽人皆知的“当代互联网第一约架”，王自如与老罗的对质直播事件。这场足以摧毁其中任何一方的论辩，最终成了经典，也悄然让两位主角对创业这件事的心态发生了一些变化——这其中，罗永浩给王自如的启发可能是，放下理想主义的身段（或曰“伪装”），去重新思考最基本的生存与发展问题。在ZEALER最鼎盛的时期，王自如俨然是新数码生活的引领者。他的个人意识也随之膨胀，但基本仍以公司品牌为先。遗憾的是，这段为整个评测行业拉高水平的时光并没有持续太久，后来王自如开始涉足汽车评测与综艺节目，最终离开ZEALER转投格力，为这段跌宕的创业之路画上句点。创业比加入一家成熟企业难千万倍，面对用户、市场、投资人和同伴的质疑也绝非易事。一家公司要往哪走、做什么创新、有没有投资、可不可持续……全是难题。如今，ZEALER依然活着，但已然失去了个性、颜色与灵魂。公司官网乍一看以为是电商促销页面，品牌充值的痕迹无处不在。从心气极高的创业公司到黯淡无光的小企业，也就是十年的光景。没有人知道王自如具体从哪一刻开始改变，但一切依然无可挽回。可惜的，不只是王自如曾几何时，王自如与当下如日中天的何同学、影视飓风Tim做着类似的事情：以科技产品为契机，用视频作为主要载体，为年轻人指引未来生活的趣味与方向。曾经有许多人确实把ZEALER当作极为重要、足可信赖的伙伴。如今后来者已经居上，数码圈或者说泛科技圈的座次早换了几轮。王自如当年的老对手们，彭林依然领着爱否科技踏实前行，那岩依然是那个温文尔雅的数码评测个体户，曾经在ZEALER效力的楼斌依旧在拆解新机器，小白评测、钟文泽成了最新的头部数码博主，大米和王奔宏也还在做着自己熟悉的事情。若说中文数码评测是个江湖，那王自如便是早期最强势的枭雄。如今枭雄不只马放南山、刀枪入库，还转身变成了一个圆滑和油腻的职场中层。只是不知道，现在以老练姿态大谈职场生存哲学，自如地宣称“我从不看工资条，我只想离领导近一些”的向上管理大师王自如，会不会偶尔怀念——那个在香港出租屋里拆开人生第一台Mac的表情青涩的王自如；那个和五六个伙伴在深圳的平房里开始做ZEALER的王自如；那个铆足了劲要与彭林、那岩争夺手机评测头把交椅的新锐评测人王自如；那个在老罗的辩才前落于下风，但依然坚信方向没错的创业者王自如；那个一门心思搞评测工具创新、内容改革，孜孜不倦地给企业找活路的企业主王自如；那个在各个平台的综艺里露脸，扩大个人和公司影响力的跨界版王自如……他是否想过，回到其中某一个时间线重新开始？他会觉得遗憾或不忿，还是觉得这些过往早已翻篇，不值一提呢？也不知道，上述不同时期的王自如，如果知道未来有一天，自己会放弃曾经痴迷的数码产品与评测，放弃承载过他和伙伴们的青春年少和改变行业现状野心的ZEALER，转向讨好成熟的机制、公司和老板以求富贵安稳，会是怎样的心情？更不知道，王自如是本性如此，还是慢慢变成这样——他是本来就向往去成熟的体制里做一人之下的高层，还是在创业过程里慢慢被种种不可抗力折磨，变得畏惧前进和变化？人生没有如果，时光不会倒流，只有选择之后的情绪处理，以及那些需要自己一力承担的结局。每个人都有选择人生道路的自由，我们或许只能表达一些非常个人的惋惜，就像一个年少时陪自己走了很长的路的伙伴突然决意转身，从此变得陌生甚至此生再不相见，我们只能尊重他的选择。但依然有些可惜，不是吗？不只是可惜王自如，也为近年来数码行业少有激动人心的变革、市面仅有的数码评测内容归于平庸的现状感到可惜。可惜一个（也可能是一大批）曾经极有抱负和野心的年轻人，一个在创业期历经磨难依然不屈不挠的创业者，一个可能的新生活方式或新行业秩序开拓者，难以免俗地去为传统秩序摇旗呐喊，成为一些年轻人先质疑再理解最后十分向往的“成功人士”，未来某天还可能归于沉寂。最后，王自如在这个出圈极广的采访里说：要想想自己离开一家企业的时候，会给企业留下什么我确实非常期待他最后会给格力留下什么，就像当年期待他每一个新视频上线时那样 ,0,0,0,2023-11-16 13:12:13
