虽然说春节整个过程有八天，但对于很多出门在外的人，想过的就只有春晚那一刻而已。按照目前的计划表，绝大多数人会工作至大年三十下午六点才放假。而春晚是每年除夕晚八点，也就是说会有很多人，无法和家人吃年夜饭、看春晚，春晚开始的时候在路上，可能跨年还堵在高速上，听着车里广播里的倒计时，所有堵车的上班族，一起过春节。我理解的年味：就是和家人去做习俗里的东西，大扫除、买年货、购新衣，如果人都回不来，还谈什么别的。大家总说越长大越没年味了，但有没有可能把春节延长到15天试试呢，从大年三十放到元宵节，谁还敢说没有年味。现在不仅上班族不开心，家里人也会不开心，很多老人一年就图个春节热闹，自古以来就讲究过年团圆，除夕夜早上都要祭拜先祖，大家一起贴对联，祈求新的一年健康顺利，而赶不上年夜饭春晚的成年人，回家剩下哪些环节呢，就只有拜访亲戚，还有拖了一年后不得不参加的相信安排，你说谁会开心？,1,0,0,2023-10-29 09:11:04
民意这个东西，就真的一点都不重要吗？,-1,0,0,2023-10-29 06:50:59
为什么这个问题下好多的回答评论区都关闭了？,-1,1,8,2023-10-29 02:45:19
只是个猜测，除夕不放假一定程度上减少了人口流动，可能是战前的准备，如果除夕正常放假导致大量人口返乡过年，这个时间段一旦发生战事大概没几个人会选择返回城市，都是往乡下跑，对于我国的体量来说即便是短时间的社会停摆也是可以稳固的，前提是人口未大量流动之前，试想城市和乡镇配套的粮食储备，防空系统等等，人口集聚在城市反而是最安全的，口罩时期大家也经历过。最后，如果人口流动和战时准备撞到一起变数还是挺多的，当然，以上回答都是灵光一闪，大家都说是打工人的苦，不如换个角度想开一点哈哈哈。,-1,0,0,2023-10-29 01:25:25
七旬老人多锻炼，爬上爬下贴完春联贴窗画，八岁小孩早当家，中午杀鸡晚上又杀鸭,-1,0,1,2023-10-28 22:19:51
我同学听了之后课都不想上了。,1,0,0,2023-10-28 21:37:42
,1,0,0,2023-10-28 21:26:20
我记得以前有人统计过，朝鲜法定节假日甚至都比我国多属实是遥遥领先了，已经到了朝鲜人看了都觉得惨的地步评论区有人给出了具体数据,1,7,229,2023-10-28 20:51:44
怎么，你不服期？,0,0,2,2023-10-28 19:42:40
祝大家雅思托福拿高分,0,0,0,2023-10-28 19:30:28
也就是体制内的爷爷们会有影响，体制外的孙子该放假还是照样放,1,0,0,2023-10-28 19:13:46
怎么看？——我躺着看,0,0,0,2023-10-28 18:40:43
说个好玩的，在新媒体、传统媒体刊发“我们的节日”相关内容是创城的重要指标之一。,0,0,0,2023-10-28 18:30:42
哈哈哈有个神评论即然几个月不发工资也能来继续上班，那干嘛发工资。。。,1,0,0,2023-10-28 18:29:20
什么⊙∀⊙？苹果都把这一天定为中国节假日一定谨防境外势力打传统文化牌！,1,0,0,2023-10-28 17:52:49
洋节，韩国的节日不放也摆了。,-1,0,0,2023-10-28 17:41:27
去年相亲过一个姑娘，老家县城公务员，公检法体系。吃饭的时候我问她，你老家是外地的？过年回家赶得上吗？她说他们有一年20天的带薪事假，注意不是年假，对你没看错，带薪事假。所以她都是把这20天留到过年那个月，一次休一个月。那我说平时有个事咋办呢？她说平时用年假啊，而且其实打个招呼就好啦。今天我看到这个提问，心血来潮搜了一下。找到了这个20天带薪事假的法律依据。不得不说不亏是公检法啊，依法办事！！！点赞！！！,1,5,73,2023-10-28 17:27:54
我突然理解那句“吃了这顿饺子我们就算过年了”，给咱们预警呢 ,-1,1,0,2023-10-28 17:15:55
既然除夕都不放假了，那春晚也没办的必要了呀，又费钱又没人看的；强烈建议：取消2024年春晚,0,0,2,2023-10-28 16:02:28
春节仪式节日感最浓就是除夕这顿年夜饭了，过了之后，感觉后面的假期每一天都是在等上班,1,0,0,2023-10-28 14:32:52
为国效力,1,0,0,2023-10-28 14:27:57
屎,1,0,0,2023-10-28 14:07:07
如果我是政策制定者，我肯定会觉得自己绝顶天才：一，我可以增加普通社畜的上班时间。自建国以来，春节假期从超过两周减少至不足一周，全国工作时长会增加数百万小时，百分百会增加经济效益，不得拉动GDP？二、我可以集中激励普通人的消费需求。工作那么苦逼，假期那么稀缺，广大人民群众大概率会报复性消费一波，轻轻松松地刺激内需。三、我可以改善国内劳资矛盾突出问题。不管之前中国的企业有没有落实好带薪年假制度，只要今年的企业主大发慈悲或良心发现，在除夕当天给打工人放了一天假，那么就算落实了带薪年假制度。以后打工人再出言讽刺的时候，自然没有那么理直气壮。……总而言之，这简直是一个不世出的天才搞出的多赢设想，面子、里子去全都有了，赶紧呱唧呱唧。如果我是福利待遇完善的打工人，我肯定会在表面痛心疾首，内心偷偷窃喜——无论国家怎么规定，反正我们除夕都会放假，人上人的感觉真是美好呀~如果我是毫无福利待遇的打工人，我肯定会觉得无所谓——除夕放假？搞笑，我们一直就是365天天天无休，还是低头干活吧。如果我是真正正正的普通打工人，我肯定会觉得不忿或者无语——可是我就是有滔天的怨言也没有人重视，只能在知乎上正讽反讽一番，并默默接受这一切。为什么要假设我是以上这几类人呢？因为我自己对这个调休政策毫无波动，在一定程度上，我已经实现了时间自由。我可以在任意一天休息，也可以在任意一天工作。工作日和休息日全然根据我的心情与需要安排。我希望，大家都可以获得这种时间自由，而不是被政策或制度驱使，被老板或项目驱使。当然，可能会有人问我：说得容易，普通人怎么才能获得时间自由？那就不是本文探讨的内容了，大家可以关注我的系列文章，先从头脑自由做起~,0,0,0,2023-10-28 14:02:41
我认为2024年放假安排存在一定的不合理性。除夕是中国最重要的传统节日之一，应该被纳入法定假日，让民众有足够的时间与家人团聚。除夕不放假可能会导致民众无法充分享受节日气氛，也可能对传统文化的传承产生不利影响。,1,0,1,2023-10-28 13:47:42
2024年放假安排最新消息出炉!!!这几天被这个除夕放假弄得上班人也是惊心胆颤得，想着好不容易一年到头回家，陪家人过春节，结果不放假​，这不是闹吗？下面给大家梳理一下放假​情况：2024年2月9号是除夕，放假是从2月10号开始放到2月17号（放假调休，共8天）2月4日（星期日）2月18日（星期日）上班但是都还是鼓励各个公司以及单位结合一些实际情况进行一个调休​。此消息是今年10月25日，国务院办公厅发布​,0,0,0,2023-10-28 13:14:42
个人看法认为明年的放假安排很合理。以前除夕不放假的时候，一变成除夕放假多少人都在发牢骚，把除夕隐性放假的福利变没了。明年春节放8天假，而且国家还鼓励除夕放假，让你潜规则成休息9天，节前节后也不用连上7天班，多合理。结果我看看评论一样是骂声一片。我真的很难理解。都这么期待不上班，要么和我一样数着日子等退休，要么就不要打工自己当老板嘛。,1,1,7,2023-10-28 13:11:17
春节放假见下图，一会要用。咱们不妨设想一下，如果按照以往9号开始放假，连续7天会是个什么情况。从9号开始连续7天，也就是放到15号结束。扣除两天周末10号、11号，还是需要调休上班2天，有两种可能：如果是4号和18号补班，那么16号正常上班，17号休息，18号继续上班，而且节前也只是连上5天班，正常可接受。其实这种情况下，16号请假，也是连休9天，跟正式的方案无差。如果是17号和18号补班，那就就得从16号一直上到23号，连续8天，那肯定更要被骂死。这方案可以直接划掉。所以参照1的情况，我只能说是大家的选择权（要不要请1天假凑9天连休）没了，被强制连休9天，毕竟除夕真能憋着不请假回家的也是少数。,1,0,0,2023-10-28 11:41:29
Happy korean new year！,1,0,0,2023-10-28 11:04:12
想不明白不懂扣那一天是个什么意思  教育你们？,0,0,0,2023-10-28 10:56:18
反正我小时候过年过的就是除夕那一天，最快乐的一天，第二天就没那么热闹了，甚至要吃昨天的剩饭剩菜。,0,0,0,2023-10-28 10:53:52
不好说不能说不敢说,-1,0,0,2023-10-28 10:51:35
除夕不放假，圣诞节也不放假，所以在我国，除夕和圣诞节和国际爱牙日地位是一致的,1,0,0,2023-10-28 10:49:50
？,0,0,0,2023-10-28 10:48:35
那个不咋地的大型晚会，还有吗？累了一天，在家还想被教育嘛？,-1,0,3,2023-10-28 10:41:59
再苛刻的老板除夕也会考虑让员工早走回家过年。这样假期相当于多了半天到一天。,-1,0,0,2023-10-28 10:26:28
先是惊讶，然后就是等待公司安排，说不定额外给假呢，也有可能包年夜饭，再者会不会发红包呢，哈哈哈哈哈2023.10.28收到公司通知，过年给了两天额外的假期，我司优秀传统,-1,0,0,2023-10-28 10:22:01
纯纯有病,0,0,0,2023-10-28 10:21:41
“三百六十五个夜晚，最甜最美的是除夕”。,-1,0,0,2023-10-28 10:09:02
有那么一个群体，他们可以严格遵守8小时工作制，而且通常通行时间很短。他们掌握了各种法律规则制定，觉得所有人应该也和他们一样。,1,0,1,2023-10-28 09:58:19
我觉得没啥问题。慢慢地我开始理解专家们定的这些政策，什么家庭存款50w、开着小汽车下地干活等等，我觉得都是合理的。因为这些专家们已经无法理解p民们的基本生活状况，他们从小生活环境就是衣食无忧，看病是协和、出门是奥迪、脸上是迪奥。上下班都是家门口，出远门那是全球游。除夕5点下班，5点30就能吃上年夜饭。他们无法想象会有人一年赚不到区区几百万，他们觉得一年存下来七八十万应该是最穷的家庭、最难的中国人。我理解他们，因为他们确实没见过这么困苦的百姓，他们的认知里不存在这部分意识。老百姓去过故宫的都很少，能在闭馆的时候找关系就去就更难，能在闭馆期间开车进去难上加难，人家开得还是大G。这之间不是鸿沟，而是一座又一座的珠穆朗玛峰。差异之大，用天地之距亦难形容。专家们想象不到我们的生活，就像我们也想像不到每年随便花个几百万是什么样子，存款八位数九位数又是什么感觉。他们认知里的底线情况，却是我们大部分人的天花板。,1,7,135,2023-10-28 09:56:57
除夕当天放不放假，压力给到企业，老板焦虑地夜不能寐。,1,0,0,2023-10-28 09:52:33
五大亮点,1,0,0,2023-10-28 09:24:07
仔细看看，人家在放假通知里面是提倡企业积极调休的。至于非企业单位，到了年二十六以后，你到机关单位去办事，看看能不能找到人？,-1,0,0,2023-10-28 09:21:33
大家一起在公司在路上在每个角落过除夕,1,0,0,2023-10-28 09:06:57
重大消息！2024年最多可放365天！最新消息，2024年春节假期可放8天，著名评论家王多多表示，如果配合辞职，最多可以放假365天。,1,0,1,2023-10-28 08:46:31
挺好的，起码除夕不用值班了。,-1,0,0,2023-10-28 07:42:24
都不生是吧，都不买房是吧，年都TM别过了！,-1,0,2,2023-10-28 07:08:20
当然是为了锻炼孩子，让放寒假的孩子做年夜饭，父母去上班，夺贴心呐,0,0,0,2023-10-28 04:15:50
别如何看待了，类似假期放假安排如何看待了那么多年，不还是，擦干泪，默默地骗自己忍忍就过去了。,0,0,1,2023-10-28 00:55:06
以前，我妈：“还是小时候的过年才有意思”我大大的疑惑“难以理解，过年这么好玩，怎么会有人觉得没意思！”只要过年就太棒了~我们还在走亲戚，我们还可以……干很多事情看着妈丧丧的脸，我那时想我绝对不会，说出过年无聊这种话，太奇怪了从前，我坐两个小时客车，再走半个小时的路，回老家现在是半个多小时就到了~然而，没有寒假的世界，就是一掰着手指头的日子，一天……两天……工作未完成的折磨，新工作的催促，成年后越来越。国庆比春节长！没错，我也是回家需要换乘n多小时的人，路上过去一半了，那寒酸的几天，除夕的意义呢？或许又不是放不放假的问题，以前返乡大军，很多即使除夕那天到不了，年味儿十足，人们有精气神，是一种期待，再疲惫，可以打个电话，都是在一起过年。它是个神圣的，他们为了挣钱，回不去没啥，多挣钱，越过越好就行，有朝一日和家人团聚。以前啊，老板不放人，本身不合法，本身就是诟病，在大环境下是接受批判，现在呢，自动默认了！缺那一天假吗？有没有想过是本末倒置了？,-1,0,0,2023-10-28 00:49:49
就我观察来看，每年腊月回老家最早的都是私企上班的，鲜有私企到了腊月二十八还在上班，很多都是腊月二十五左右就放假。甚至我老家火车站的黑车司机都知道这个规律。反而是公务员、事业单位上班的一般都是到了二十九才赶回家。也就是说，实际上除了军人、警察、医生、消防以及其他需要值班的人员，绝大部分单位、企业、社会组织都在二十九之前都让人回家。所以除夕这天不放假，并没有影响到太多人，反而等于变相延长一天假期。那么多人跳着脚骂，实际上他可能去年腊月二十八之前就回家了。…………………………………………………仔细看看假期的日程安排，就知道除夕这天不放假是费了心思的。试看，假如除夕放假，那么按照3（法定假期）+2（周末）+2（调休）的安排，会是下面这样放假：方案1：除夕到初六放假7天，初七上班，初八休，初九再上班6天。或者是这样：方案2：除夕到初六放假7天，初七初八上班2天，初九休1天，初十正常上班。或者这样方案3：除夕到初七放假8天，初八开始上班7天。看完图我们来比较一下，方案1和方案2放假和休息犬牙交错，会让人很难受，以往也这样调休过，被骂的狗血淋头。那么方案3是不是好些呢？看上去齐整了，但是又出现新的问题，首先众所周知春节假期和其他长假不同，大家的感受都是特别累慌里慌张过完春节紧接着上7天班，以前也是骂声一片。而且春节假期前后两个周末一个调休一天，一个休不了，叠加春节假期的疲劳，也就是说整整三个星期的疲惫感无法缓冲。那么这样一比较，把除夕那天的假拿到初七放，和初八的周六正好连在一起，而且后面只要上班6天。但同时因为大部分企事业单位的人之常情，三十都会放假，所以实际上等于休假9天。休9上6和休8上7，感觉就明显不同了。所以说这个方案并非是拍脑袋想出来的，而是在现有情况下的最优解。…………………………………………………当然众口难调，无论怎么放假，都会有一部分人不满意，都会有人骂，只能找最大公约数。实际上国务院对全国的数据样本调研分析，掌握是非常全面和精确的，这也必然有数据支撑才能决定。记得12年前，也曾有一次除夕不放假，当时官方给出的解释就是经过调研，大部分单位无论放不放假实际上都会让员工提前回家过年。在中国的文化传统里，过年是最重要的节日，年三十有着重要的精神意义，年三十不上班是大部分企业主和员工约定的、不成文的规矩。当然，餐饮等服务行业另说，毕竟春节期间生意火爆，可以给高补贴留员工。一是员工需要回家过年，二是老板也要过年啊。再者说，大过年的，三十那天大部分工厂企业都没人了，还有什么业务要在年三十办，有什么生意要在年三十做的？恕我直言，如果你的公司年三十不放假还要你正常上班，那么这家公司一定不是什么正规公司，也没什么前途。…………………………………………………有人反驳，为什么对于除夕不放假，在网络上铺天盖地的都是骂声，鲜有支持的声音？这有两个原因。一是幸存者偏差：支持者一般不会为了表达支持而专门发帖、跟帖。只有不满的人才会专门发帖发泄，叫骂的人多了，支持者就更不敢吭声了。二是从众心理，有很大一部分人，无论怎么放假其实对他都没有影响，可能二十五他就在老家了，但是他看到别人在骂，也要跟着骂几句，起哄架秧子发泄情绪。即便是换成上述的3种方案，这种人还是会骂。纯粹为了发泄情绪。反驳的知友们，建议你们认真看完我纯手打的这篇回答后再来友好反驳。不接受情绪输出。谢谢！,1,2,3,2023-10-28 00:07:42
5个亮点哈哈哈哈哈,0,0,0,2023-10-28 00:04:33
我没记错的话……除夕就是大年三十吧……这天我记得可是比初一还得热闹，团圆饭不是这天吃吗……,0,0,0,2023-10-27 23:39:21
灵活就业人群本来就没啥可以工作的能力，放不放都是放假。上位者们对这不感兴趣，毕竟是过不完的年，还差这一天除夕？学生们早就放假了，还等到除夕？个体户们早就关门贴春联了，谁还管什么调休放假？老板们可高兴了，以前除夕加班要给加班费，这回要员工请假才能回家，大赚特赚。苦了谁呢？,1,0,0,2023-10-27 23:15:20
有时候就觉得我这种希望增加法定假日派被连调休都算不清的一群本意是好的但是脑子不太行的人裹挟着就挺累的。既然不指望企业做人那只能国家动手强制多放点假咯，不过连劳动法都不好执行的情况下你又指望来点强制的显然也很难。当然我觉得如果有一天良心发现了，落实劳动法之后，那些原先加班多的公司最好工资直接拦腰一刀，因为我觉得你们的高工资就是靠不遵守劳动法堆出来的，你们也不配拿那么多，就该我们这种遵守劳动法的公司多拿点。,-1,0,0,2023-10-27 22:33:29
除夕不放假，算不算伤害了民族感情？,1,0,1,2023-10-27 21:02:08
你猜为什么有法定节假日 没有法定节假日真有傻子企业不放假的到时候不放假肯定整出来一堆事 维稳成本太高了不是因为你需要休息才给你放假是因为不放假你会惹事所以才放假,0,0,0,2023-10-27 20:52:32
我宣布，所有回答中，评论区已关闭是最好的回答！不接受反驳！,-1,6,183,2023-10-27 20:43:56
1.以前在联通，全年无休，三十中午刷车的时候还要出去修故障，这种单位规定不规定除夕放假没啥区别2.后来上了某公司，坐办公室，朝九晚五，年三十一般上班，但是也是擦擦窗户擦擦桌子做做卫生，就回家，规定不规定放假也没啥区别啊3.再后来上了某工厂，上12休24，不存在过年过节，因为生产线停了再开，以十万为单位算，这种单位规定不规定份放假也没啥区别啊,1,0,0,2023-10-27 20:35:49
我还以为刺激消费是认真的，产能过剩是真实的，刚好相反。如果真的在乎消费，为什么还要把大家赶着去生产，压缩消费时间呢？,1,0,1,2023-10-27 20:17:02
抗压测试吗？,-1,0,0,2023-10-27 19:37:46
二十九下午和三十可以去事业单位办业务试试。再去企业单位看看，就明白了,-1,0,1,2023-10-27 19:35:33
省流：元旦1天，春节3天，清明1天，劳动1天，端午1天，中秋1天，国庆3天。全年总共11天。遥遥领先了。,-1,0,0,2023-10-27 19:18:25
虽然大家都不高兴，但是除夕现在确实不是法定节假日。2013年12月11日《国务院关于修改〈全国年节及纪念日放假办法〉的决定》第三次修订后，春节放假又从除夕到初二改回了初一到初三，但是除了2014年，除夕都进行了调休。所以说，按照现行的规定，除夕放假反而是实行调休的结果，属于负负得正了。不要误会，我一点也不喜欢调休凑长假。,1,0,0,2023-10-27 19:06:46
其实很多企业（尤其是私企），很早就放假了，必须按照国家规定来的都是政企事业单位，所以这个规定充分展示了领导的带头表率作用，展示了党政机关的无私奉献精神！应该被广大人民群众拥护和支持！,-1,0,0,2023-10-27 18:59:40
真拿社畜不当人是吧！！！,1,0,1,2023-10-27 18:23:06
“如果配合带薪休假可以放假九天”好家伙，如果的假期都要算进去的话，那这真的是缺大德了,1,0,0,2023-10-27 18:21:16
以前都是这样，大惊小怪，单位会提前放的，农民没有法定节假日，没有福利，照样高高兴兴过大年，三十晚上死猪娃，有你没你照样过年,0,0,0,2023-10-27 18:14:48
所以除夕对于国家来说是可放可不放了，从初一可以放到初八，和从除夕放到初七都是7天，那为什么不能从除夕开始放？多少小企业能把员工压榨地透透的，会因为国家的这种鼓励放假多给员工一天假吗？,-1,0,0,2023-10-27 17:27:58
在这个问题下看大家回答看的最久，就喜欢大家这样阴阳怪气的口吻,-1,0,0,2023-10-27 17:19:34
用眼睛看呗,-1,0,0,2023-10-27 17:19:17
对这个其实我并没有什么特别大的意见，其实这样放假的本意是为应对前几年休7上7怨声载道，所以才出的政策；另外，也看到了“鼓励各个企业单位结合年假制度让员工在除夕放假”等标注，所以不让休假的到底是谁呢，很多单位如果不是因为法定假日放假，真的会给员工放这么久的假期吗？我认为不能一味怪政策。,-1,0,0,2023-10-27 16:52:55
我想说，只要大家都放假，就等于都没放假。谁赞同，谁反对？,1,0,0,2023-10-27 16:52:23
说实话，我知道这个消息的时候甚至没什么感觉，别人吐槽的时候我还有点不能理解。毕竟调休又不是第一天，都那么多年一直是调休，一直放假就是放不起硬要放的状态。而除夕不放假这个事情，我也没意识到问题的严重性，单纯从过年气氛来讲，我觉得除夕跟平常的每一天没什么区别。毕竟印象中都是除夕当天都在回家的路上，想要提前回家，总要各种想办法请假，凑假才可以争取回去。除夕到大年三十，为了一点加班费不回家的打工人大把。而且现在回家也是各种催婚，老家看着自己长大的老人慢慢的都不见了，以前的小伙伴也不知道去了哪里，村里跑动的孩童和新媳妇也不知道哪里来的，都不认识。而且其实我不太懂几个点。1.为什么突然减少了这么重要的除夕假期，本来一年到头的法定节假日就很少，不增加就算了，为什么还在减少，还减少这么重要的？是经济进一步下滑的信号吗？少放一天就能增加多少收入吗？2.其次谁制定的假期，我查到是国务院，但是国务院具体谁呢，这个时候连个负责人都没有，只是简单的通知了，也没个发声的渠道，虽然说了也没用，但是总要表明一下自己的态度，小老百姓的意见这么不重要吗？3.调休的事情反应了那么多年，也无动于衷，怎么今年还专门对调休这个事情做了解释？好像很为我们着想的样子，好像是在意了感受的感觉，但是反应了又不听。不懂为什么会有解释这个事情？4.中国人不配多几天假期吗？搞那么抠搜为啥？我印象中五一还有七天乐，现在怎么放个假这么困难，到底难点是什么？能不能公示出来？可不可以搞个投票？有谁知道的，也可以分享一下，确实不能理解这几个点。而且这么放假只会让我觉得人口还是太多了。之前没有注意，现在觉得大街上孕妇还是挺多的，新生儿很多，幼儿园很多。周围有怀孕的小伙伴，去医院产检还是要排很长的队，上学还是各种要求。,-1,0,0,2023-10-27 16:42:49
多少年没放过除夕了，你们都没察觉的吗？,-1,0,1,2023-10-27 16:41:02
春节不旅游不消费不看春晚，会怎样,-1,0,0,2023-10-27 16:39:14
其实我觉得法定假日规定除夕不放假挺好的，因为我们公司一般都会在除夕前2、3天就放假，让大家早点回家办年货、搞卫生，外地的员工还可以再早走一两天，公司也不会记考勤，默认大家都上班。这样初八还休息，等于多出来一天假期。我想，除夕不放假，是默认各单位除夕会自动放假吧。当然，对于那些没有人性化管理的单位，就只能表示同情了。,0,0,3,2023-10-27 16:27:35
亮点越来越多，创新越来越多，还不生二胎庆祝一下？,-1,0,1,2023-10-27 16:15:19
