明年春节从初一至初八连休8天鼓励各单位安排职工在除夕休息；除夕至初八小客车高速免费通行9天10月25日，国务院办公厅发布关于2024年部分节假日安排的通知。经国务院批准，2024年元旦、春节、清明节、劳动节、端午节、中秋节和国庆节放假调休日期的具体安排如下：■ 解读10月25日，国家发展改革委官方微博发布中国宏观经济研究院研究员邢伟的解读文章，称2024年部分节假日安排主要呈现出五大亮点。亮点 1可休9天 史上最长春节假期2024年春节至少放假8天，从初一放到初八，如果配合带薪休假可以放假9天，堪称新年第一份大礼包。虽然除夕当天名义上不放假，但鼓励各单位和机构根据实际情况来灵活安排。同时高速公路已经免费了，实质上就是创造条件给老百姓多放一天假。春节假期的延长，能够满足广大群众有更多时间用于亲人团聚的心愿，还可以实现一个假期先团聚、后旅游的小目标。这是在依据《全国年节及纪念日放假办法》规定的基础上的创新之举、暖心之举，充分体现出政策制定者的用心良苦和精心设计。亮点 2不得不调 但更加人性化更具灵活性调休是放假安排中社会公众普遍关心的话题，是否调休以及如何调休，目前社会公众的观点差异比较大。总体而言，调休比不调休好，而且是不得不调。因为7个法定节假日中，春节、端午节和中秋节是按照农历来确定的，元旦节、劳动节和国庆节是按照公历来确定的，清明节又是按照节气来确定的，与公历历法中的双休日不够衔接，如果不做调休，基本上每年都会出现部分节假日与双休日之间间隔1个工作日、造成节假日“碎片化”等情况，形成很多“单蹦”，那就不是“累觉不爱”，而是“累且不爱”。调休就是在节假日总量固定的前提下，为避免节假日“碎片化”所做出的有效政策安排。2024年通过调休，形成了“9573”的放假时间安排，展现出较强的人性化和灵活性。亮点 3尽量不打乱人们正常生活节奏2024年全年假期比较均衡，通过调借邻近周末，春节至少8天、国庆7天、劳动节5天，元旦、清明、端午、中秋都是3天，长假后最长工作日也只有6天，调整的幅度比较小，避免出现长假过后工作时间长的局面，较好地满足了人们劳逸结合的实际需要。亮点 4更好满足群众出游要求和休假期盼我国法定节假日具有时间分布“上半年多、下半年少”、日期间隔“上半年短、下半年长”等特点，5个集中在上半年。此次放假安排充分考虑到这些法定节假日的日期特点，形成了四个3天短假、一个5天小长假、一个7天长假、一个9天超长假的假期分布，较好地实现了长假与短假相互交错的局面。通过长假、短假的合理搭配，人们可以提前做好全年的出行计划与安排，在探亲、休闲、旅游等方面拥有更多更好的日期选择，避免“一窝蜂”出行和“扎堆”旅游。亮点 5鼓励落实带薪年休假 能放则放国办发文中首次提出了鼓励结合落实带薪年休假等制度来落实，实质上就是倡导企事业单位在保障基本运行的前提下，能放则放。我国现行法定节假日总天数为11天，周末休息104天，带薪休假5-15天，总假期天数在国际上处于中等偏上水平。之所以大家仍然觉得假期不够、获得感不强，主要还是带薪年休假制度落实不到位，大家不能错怪法定节假日安排和调休了。此次放假安排，通过鼓励用人单位将除夕放假纳入带薪年休假安排，就是一次非常巧妙的探索。相对而言，带薪年休假的假期时间更长，安排更加灵活，更加适合人们错峰出行、分散安排的客观需要。只有将带薪年休假与法定节假日统筹协调安排好，劳动者的休息权利才会更有保障，保障得更为充分。■ 交通明年春节假期小客车高速免费通行9天根据《国务院关于批转交通运输部等部门重大节假日免收小型客车通行费实施方案的通知》，以及《国务院办公厅关于2024年部分节假日安排的通知》的放假调休日期安排和“鼓励各单位结合带薪年休假等制度落实，安排职工在除夕（2024年2月9日）休息”等要求，近日，交通运输部印发通知明确，2024年春节假期小型客车免费通行时段起止时间为2月9日（除夕）00:00至2月17日（正月初八）24:00。通知提出，2024年春节假期时间较长，预计公众出行意愿较强，公路交通流量将再创新高，路网保通保畅和服务保障工作压力较大。各省级交通运输主管部门要充分总结2023年中秋国庆假期公路网通行服务保障经验做法，深入分析部分路段拥堵原因，会同有关部门提前研究进一步提升路网保通保畅服务措施，按照部的统一部署，切实提升路网通行能力和服务保障能力，为人民群众便捷高效出行提供优质服务。,-1,0,0,2023-10-26 14:44:08
说得好像安排了调休你们真的能休一样。,-1,0,0,2023-10-26 14:43:55
我感觉为什么大家会无脑吐槽了！！！这明明就是九天假！！！以前都是初七上班，今年要到初九才上班。就像楼下有一位答主说的你觉得除夕好请假还是正月初七上班好请假！！！没有理解国家的一片好心！！！,-1,6,0,2023-10-26 14:40:52
做外贸的，最大的感概就是经常看到客户休假通知的邮件,1,0,2,2023-10-26 14:40:15
脑子里如果装的不是屎，真编不出来这样的假,-1,0,0,2023-10-26 14:39:13
炮也不让放，跟平时也没什么区别，取消也无所谓，初123去单位混个三倍。,-1,0,0,2023-10-26 14:38:51
建议除夕不放，元宵节放假三天，倒逼企业从除夕放到正月十八，这是GF为大家争取到的十八天假期。附：还未入职场，科研民工的日子里珍惜寒暑假那十几天吧。,1,0,0,2023-10-26 14:38:11
我们建筑行业，基本腊月15就操持放假了，最晚小年也放了。其实对我个人影响不大，但是对我家人以及过年的节奏有影响呀。聚不到一起不说，坟都没法上，大过年的，一大早别人家一大家子拿着鞭炮贡菜去上坟，可是我只能自己去。别人家忙着贴对联，打扫院子，挂灯笼，摆水果瓜子糖块，我只能自己操持这些。我们除夕那天中午的饭是最丰盛的了，只能改到晚上吃饺子了。我有点生气。,0,0,0,2023-10-26 14:33:41
第一，调休不是为了让休息的，是为了让去消费的，只要调休期间还有去旅游消费的，调休就不可能取消。第二，春晚是给人看的，不是给矿看的，所以矿能不能看，喜不喜欢看，春晚从来都不在乎，更不会因为矿没时间看就取消。,1,0,68,2023-10-26 14:33:33
这种大事儿确实让领导们费心了。我看看有没有机会大年初一不休息，省的在家喝西北风。,1,0,0,2023-10-26 14:32:54
这一招是太极,1,0,0,2023-10-26 14:32:52
我来说句不好听的的。如果连和自己老板要一天除夕当天的假期都搞不定，凭什么问国家要更多的假期。拓展延伸：如果能搞定老板除夕请假，那么就不存在除夕不放假的问题，那么自然没有动力去改变什么，最多抱怨两句。如果连除夕放假这事儿都搞不定老板，更别谈争取国家法定假日多一点，那么只能是抱怨，而没办法做出什么去改变。结论，法定假期不需要改变，闭环了。,1,0,0,2023-10-26 14:32:37
莎×，不如直接宣布今年过年不放假。在岗的都必须发3倍工资,1,0,0,2023-10-26 14:32:01
人家是不是说了‘估计除夕放假’，我觉得正常的企业，单位，公司，团体，都会放假的吧，除非员工‘自愿’上班。 就是这样。,-1,0,0,2023-10-26 14:29:58
以后别说崇洋媚外这四个字自己把自己脸抽肿,1,0,0,2023-10-26 14:25:04
我就记得当年改成除夕放假的时候，网上也是喷的，因为大部分企业初除夕本来就放，这么改等于少了一天白嫖假，现在改回去了又骂，个个都说自己的公司严格执行制度，不会让白嫖，请假还扣钱。让这两波人打一架吧。两拨人不可能都满意。,1,0,2,2023-10-26 14:24:24
中国劳动人民假期已经少得可怜。多给劳动人民放一天假，可能相关人员就会被资本家处死。让矛盾来的更猛烈些吧！,-1,0,0,2023-10-26 14:24:09
怎么个鼓励法？能像鼓励就地过年一样鼓励吗？,1,0,0,2023-10-26 14:24:09
其实各行业各单位都是自主安排的，不用管发改委的规定。,-1,0,0,2023-10-26 14:24:01
我们不能说，我们不能做，我们生活多美好~,-1,0,0,2023-10-26 14:22:11
以前除夕也不放假的,-1,0,0,2023-10-26 14:20:50
翻了半天一堆评论区都关了这是咋啦这是(ﾉ ○ Д ○)ﾉ　,-1,0,0,2023-10-26 14:20:16
现在又出现一种舆论：当年除夕不放假，初一放到初七。后来改到除夕放到初六。也是全民吐槽，因为本来除夕可以默认休息一天至少半天，除夕变成官方放假，等于少了一天。你们咋这么难伺候呢？这种阴阳怪气的评论，无非就是想把水搅浑，造成大家就是纯纯的无脑喷子的假象。事实情况很简单十年前，企业根本不需要鞭打快牛，早早就完成利润，让财务头疼的是怎么藏一点利润明年体现。到春节那个月，就开始陆陆续续各种理由发年货发卡，张姐赵哥一边上班一边唠嗑。年终奖早早就发掉了。原则上除夕当天不放假，但其实提前个一两天不来上班都睁一只眼闭一只眼。而后来即使放假是除夕放到初六。很多单位也会选择初八上班，因为开门发，讨个吉利。现在，为了完成指标，到十二月底还在小小的报表上挖呀挖呀挖，预算指标从十一月撕逼到新年。年货这种能有个旺旺大礼包就不错了。为了部门绩效和奖金，几个部门经理能走马灯一样从老总办公室进进出出，年终奖么计算一稿又一稿，越算钱越少。本来根本瞧不上过节期间零星订单的蚊子肉，这会儿都当鸡腿了。前台部门都拼了命了，你们中后台也别闲着啊。虽然大伙儿钱少，但活儿多啊。项目不停工，那各种检查、各种报表也别停啊。这种情况下，大伙儿就盼一个假期，逃离工作，喘口气。简而言之一句话当一个企业利润少了，工作压力大了的时候，千万不要自作聪明去动员工的福利。无论你怎么动，都会挨骂。大家其实也不是真在乎那一个月一两百的福利，而是早就想骂你了，刚好找到借口而已。这么说吧今年除夕的时候，我就一早例行去单位巡查了一圈，然后回家，刚好遇到老婆小孩拿着小板凳出来，说好久没晒晒太阳了。三个人就在小区花坛互相靠着，在阳光下迷迷糊糊睡了二十几分钟。那是我感觉最温暖的二十几分钟了。。。如果这个场景变成，除夕5点半回家，年初一去巡查。。。。我光想想都要骂街。。。,1,17,185,2023-10-26 14:20:04
我们国家像是多放一天假GDP就要崩盘了一样，反正生育率会给出答案职场的卷，只有职场人懂原创不易，分享或转发请尊重版权，注明出处或来源。原文链接：https://mp.weixin.qq.com/s/7GwzmI212oEpVeqZvaHiYQ编者寄语：这篇文章来自我的专业知识分析和实操经验。作者宇哥，坐标上海，前上市通信公司项目总监，全日制985通信工程硕士。通信行业十余年工作经历，让我养成了做事严谨的习惯。无意中转身成为了一位保险从业人员，经过多年的沉淀和蜕变，目前主要专注于中高净值人群的高端医疗和养老规划。接下来是正文。本篇文章来说说职场的卷！相信也是很多人都正在或者即将面临的！职场的卷，只有职场人懂。最近和一个通信行业的老同事聊天，感触颇深！这也是很多步入中年的“职场老人”面对的危与机！前两天，无意中和一位老同事，聊起了以前公司的工作情况！他和我无奈的谈到，三年前由于部门调整换到了一个新的部门，但是新部门的领导对我不是特别熟悉，一直没有委以重用。最近三年公司业绩越来越差，2023年开始每个季度都会有“优化”名额，差不多每季度3个人吧。所有的同事都岌岌可危，但是因为自己不是现在部长带过来的老部下，所以裁员的指标会留在这些人名下。他在公司工作了11年，所有的青春都奉献给了这家公司！为了不被优化掉，只能疯狂加班，每个月的加班时间都在70个小时之上。但是我是有家庭的人，我没有办法像刚毕业的小年轻那样，每天加班熬夜！拼！他很迷茫，为公司工作了这么久，公司“优化”你只是一句话的事。但是我却没有任何准备，我目前这个年纪，“下来”后，去友商也没戏，我除了干通信，我啥也不会了！为了保住饭碗，我只能每天拼命的加班，熬到退休了！听到这些，我突然很心酸，这是所有的职场老人，都面对的一个问题，如果自己在40前升不上去，公司也不会多么重视你，相信你不敢主动离职，所有的机会都倾斜给年轻人！工作了小半辈子，接下来的职业生涯难道就这样了吗？为什么会这样？对于公司来说，希望保护好自己的员工，好好工作，让员工生活在“温床”里。对外界所有的事情都不敏感，踏踏实实的为公司创造效益就足够了！公司并不希望他的员工能有多项技能，只要能在工作岗位上勤勤恳恳就足够了。对于很多人，他并没有意识到未来的职业生涯会有多么危机。尤其是在互联网领域，it领域。最近三年，因为口罩的原因，各行各业都很惨，经济受的冲击也非常大。2023年，尽管已经全面放开了，但是寒冬仍旧没有结束。为了保证公司的正常运营，优化也就成为了一个不得已而为之的必然结果！但是一方面要延迟退休，一方面又是各种优化。对职场人来说，当前和未来都非常迷茫！最近硅谷银行和瑞信银行的频频爆雷，似乎经济危机离我们已经不远了。经济下行中，我们所有人都不可能独善其身。而面临这场似乎不可逆的经济下行，绝大部分人并没有准备好。我们要如何应对？1）为了让自己在职场中更有竞争力，我们必须要不断的学习。利用闲暇之余，努力创造自己的第二个青春比如可以看看现在的95后，00后都在做什么！我能不能也尝试一下？只有这样！也许优化了那一天来临之后，我们才不至于特别迷茫。2）做好财务规划，力争在自己最黄金的前20年，为自己下半辈子创造足够稳定的现金流现在海外特别流行FIRE运动，全称是Financial Independence and Retiring Early，意思就是财务独立提早退休。有兴趣的可以去考考古！【火爆全网的Fire】你存钱是为了什么?3）做好自己的养老规划养老规划，我的上篇文章有所提及！养老规划，具体怎么操作？养老是所有人都不得不面临的一个考验，未来老龄化会非常严重。我们的退休工资还能像现在每年都上涨吗？延迟退休，不得不思考的问题所有的这一切，如果我们没有做好规划，那当老龄化社会真正来临时，我们将会非常被动！有感而发！愿职场人共勉！原文链接：https://mp.weixin.qq.com/s/7GwzmI212oEpVeqZvaHiYQ历史文章养老理财专区不要认为养老问题还有拖延的机会养老金，这样规划可以终身受益！跨越一生的爱恋，顿悟储蓄险的真正意义个人养老金，个税扣除如何申报？养老规划，40岁再不做就晚了为什么买年金的都是女性呢？【火爆全网的Fire】你存钱是为了什么?40岁面对“职场内卷”，不得不加入吗？养老规划的一个原则，三个风险如何卷崩其他养老金？「明爱金彩」解决你的选择困难症保险配置理念60分钟建立终身受用的家庭保障养老金，这样规划可以终身受益干货区【医疗险选择指南1】外购药保险不能赔，保险就是骗人的？【医疗险选择指南2】怎么判断一款医疗险有没有坑？【医疗险续保那些事】买了医疗保险不给续保怎么办？【干货篇】等待期出问题，就一定不能赔吗？我们如何为自己规划一笔受益终身的高端医疗储备金？理赔案例【MSH拒赔案例】“门诊护理费”拒赔前后处理过程病历描述瑕疵导致的拒赔【非因果拒赔】【非因果拒赔要怎么应对】没告知胃息肉拒赔肺癌医疗险中关于“既往症”的一些答复重疾险专区【最值得推荐重疾险一】恶性肿瘤，各种结节可投的同方全球健易保【最值得推荐重疾险二】同方全球康爱无忧-低保费高保额的防癌重疾险【最值得推荐重疾险三】中意悦享安康（庆典版）-赔完重疾还能赔身故医疗险专区1）百万医疗【超多惊喜的百万医疗】平安e生保住院医疗-1年期2023版【没有健康告知的百万医疗】众安众民保/安惠保（升级版）【高血压/糖尿病/乳腺结节/甲状腺结节可标体】平安e生保慢病版医疗险2）中端医疗MSH欣享人生安盛卓越馨选安卓智选住院中间带臻合意君龙臻爱无忧MSH欣享和智选住院对比【中端医疗】卓越馨选2023升级产品解析【MSH欣享人生2023】年轻人冲起来！3）儿童单独投保高端医疗MSH欣生代中间带新燕宝5款主流儿童高端医疗乱斗4）高端医疗Bupa-全球最强高端医疗Bupa孕产安盛卓越环球安盛尚越环球（可含既往症的高端医疗）安盛盛世臻选-可以长大的高端医疗MSH精选MSH经典（含既往症的高端医疗）【专业详细对比】MSH精选-AXA安盛卓越环球 不同的视角看产品招商信诺醇悦2-超级便宜的高端医疗招商信诺醇享人生Plus-含门诊的高端医疗安联康睿环球-正统德国血统安联安泰高端医疗-低调的王者京东安联安享欣悦-京东也做高端医疗了中间带臻荣耀（带门诊最便宜的高端医疗）中间带臻高端-孕产及其有性价比的高端医疗5）专项医疗【宝妈备孕高端医疗险】4款保全球的产品如何买？中间带臻高端-孕产及其有性价比的高端医疗【上海北京和睦家生子】普通人也能轻松实现6）理念【高端医疗险的续保风险】-怒评某公司的不良“无缝转保”政策写在10.1号大幅涨价前-Bupa高端医疗的爱马仕海外就医-不得不考虑的一个话题900元的高端医疗，是不是在割韭菜？【吐血整理】高端医疗的齿科责任【干货经验分享】高端医疗的一个正确配置思路【高端医疗】今天聊一聊保单迁移医疗险中关于“既往症”的一些答复【预授权】谈一谈中高端医疗险的预授权中端医疗是给百万医疗“填坑”吗？7）私立医院【实地探访Parkway百汇医疗】中间带上海地区取消昂贵医院【实地探访上海瑞金系的私立-广慈纪念医院】极致的体验+极致的专家，让就医成为一种享受,1,0,0,2023-10-26 14:17:15
这个加上这个，能不能站着把钱挣了？,1,0,0,2023-10-26 14:15:18
谁愿意把孩子生在这里？,-1,0,0,2023-10-26 14:14:23
我为什么要听他的放假时间，自由职业，想休息多久休息多久,1,0,0,2023-10-26 14:11:16
两个疑问：1，有那么忙吗？2，请假行吗？,-1,0,0,2023-10-26 14:09:56
没什么看待，生活没什么不同。一如既往。,-1,0,0,2023-10-26 14:08:25
坐等春节只放初一的那天。,-1,0,0,2023-10-26 14:07:49
如果大量的人罢工  会怎么样？,1,0,0,2023-10-26 14:07:24
吴京被电击,-1,0,0,2023-10-26 14:06:47
,-1,0,0,2023-10-26 14:04:57
"#除夕不放假#要说在外打工最期待的是什么，那就是每一年的法定节假日放假安排，中秋、国庆、春节等重大节日，都是很多人翘首以盼的时间，每到这个时候，中国也就上演了假期出行的“大迁徙”。2023还有两个月，2024的假期安排也同步出炉。根据“工作人员精心研究”，终于把2024年的法定节假日”调休“出来了。具体放假安排如下：以往的假期安排都会有喜有忧的部分，而2024年的假期安排，总结起来就一个字”惨“。除夕不放假，光是这个调休的安排就引起了一大片群嘲，关于除夕不放假的相关话题也一度冲上热搜。”安排这个假期的人是不用过除夕的吗？“”工作十几年，还是第一次除夕不放假“”看似八天，本来三天是周末，还有两天是调休来的，实际只放了三天“”除夕上班？下班之后还有很多人奔波在回家的路上“类似的言语喧嚣尘上，即便有八天假期，也抵不过除夕上班带来的怨气。也不怪网友如此群嘲，本来大年三十就是团圆的日子，而当天不放假，让那些在外地打工路途遥远的人，怎么赶得上年夜饭？美国AI芯片禁令一出，发现玩游戏不能用最好的显卡了，瞬间崩溃！突然发现了全世界都bug，游戏界蒙圈了！！！RTX 4090显卡下架潮：背后的原因与影响 - 知乎 (zhihu.com)RTX 4090显卡下架潮：背后的原因与影响 - 知乎 (zhihu.com)整理了一些深度学习，人工智能方面的资料，可以看看一文看懂英伟达A100、A800、H100、H800各个版本有什么区别？ - 知乎 (zhihu.com)机器学习、深度学习和强化学习的关系和区别是什么？ - 知乎 (zhihu.com)人工智能 (Artificial Intelligence, AI)主要应用领域和三种形态：弱人工智能、强人工智能和超级人工智能。买硬件服务器划算还是租云服务器划算？ - 知乎 (zhihu.com)深度学习机器学习知识点全面总结 - 知乎 (zhihu.com)自学机器学习、深度学习、人工智能的网站看这里 - 知乎 (zhihu.com)2023年深度学习GPU服务器配置推荐参考（3） - 知乎 (zhihu.com)多年来一直专注于科学计算服务器，入围政采平台，H100、A100、H800、A800、L40、L40S、RTX6000 Ada，RTX A6000，单台双路192核心服务器等。",1,0,0,2023-10-26 14:04:51
因为我国有除夕团圆的传统，国有企事业单位有除夕不上班或者只上半天班的习惯，除夕调休会让广大国有企事业单位的员工感觉“被偷走了一天或半天假期”，所以2024年除夕不调休，而是“建议单位休假”。因此，除夕不调休会让国有企事业单位员工2024年度在11天法定节假日的基础上，至少再增加半天的假期。这就是除夕不调休的理由。这是我百度看到的。,1,0,1,2023-10-26 14:04:15
我就想看看还能写回答不？高赞们的评论区各种点不开。,-1,0,0,2023-10-26 14:03:27
底线就是这样慢慢的被试探出来的哎。。。,1,0,0,2023-10-26 14:02:59
除夕不放假，你反正来不及回家过年了。干脆去外面旅游消费吧   ,1,0,0,2023-10-26 14:02:57
