我始终觉得这件事的关注点错了，应该关注的是董明珠的态度，而不是王自如。王自如在老板面前舔，在媒体面前所表现出的舔，是几乎每个职场老油条的必备技能。别说是他，就算是那些被冠上高情商的明星，其本质也是舔。举个例子：王牌对王牌，某一次宋小宝称呼华晨宇为“花儿花儿”，贾玲来了一句“花花在我心目中一直都是国际巨星，没想到这个称呼一下子把他拉低了。”贾玲说华晨宇是国际巨星是高情商还是舔？其实都是。再比如某次典礼，黄渤说“有一次我和张艺兴陈伟霆一起唱跳，有人问我有没有压力。我说我和两个唱跳具佳的人一起跳，谁还会看我，我有什么压力？”这是不是舔？是。是不是高情商？也是。所以高情商和舔的区别只在于你看的角度和你对当事人是喜欢还是厌恶。王自如和董明珠是下属和老板的关系，加上董明珠刚因为开除孟羽童而被骂，所以自然被代入资本家的角色。那么王自如对资本家说这种话自然就是舔。但想想黄渤夸的张艺兴陈伟霆，贾玲夸的华晨宇，哪个背后不是强大的资本？他们就不是舔资本了？你没有背景，想要往上爬，有时候舔是必须的。在能理解的人眼里，这就是高情商。你如果讨厌当事人，那就是舔。你们公司没这种人吗？女领导穿件新衣服就夸好漂亮有气质有眼光变得更年轻了，男领导穿个西装就说风度翩翩英俊潇洒迷倒万千少女。和领导比赛绝对不会赢他，和领导吃饭一定会上前敬茶敬酒，说一些违心的话，什么感谢栽培啥的，不都是舔吗？这种人到处可见。怎么就见不得王自如舔呢？对于一个想成功的人来说，在你没有完全成功到不需要任何人帮忙前，你都需要舔别人。哪怕强如马化腾、钟睒睒，你觉得他们去拉投资的时候没舔过投资人？男子汉大丈夫，能屈能伸，说几句好听的话怎么了？再说了，王自如创业失败，能去格力当个副总裁，是不是董明珠对他的恩情？在媒体面前给恩人一个面子怎么了？这件事在一个成熟的职场人眼里完全没什么，反而觉得他说得很得体。给了老板面子，也回应了记者的敏感问题。这件事可能有问题的其实是董明珠，面对如此明显的马屁，她非但没有保持冷静，反而看王自如的眼神居然拉丝了。作为一个企业家，充分暴露了她感情用事的一面，那么不得不怀疑她开除孟羽童是不是也是感情用事？如果一个企业家感情用事，用自己的喜好和厌恶去重用和开除一个人，而不是站在公司的角度，那么这个企业家是有问题的，她领导的公司走下坡路也是必然的。,1,0,2,2023-11-18 02:11:54
笑贫不笑娼的风气显性化了，看久了容易走偏了。人犯贱捞了好处，再也不是偷偷摸摸的了。而是大张旗鼓的宣传“知耻而后勇于犯贱”，就像很多情感博主教小三如何带球上位欺负正室一样堂而皇之，居然还办起了付费培训班、付费业务咨询。如今的职场博文已经从高情商处世之道，过度到职场媚惑和职场跪舔，这不仅仅是自己吃相越来越难看，也是误导新人毁掉正确价值观，更是败坏企业正气，动摇企业选拔人才的根本，劣币驱良币企业丧失长期竞争力。自如，不是自立，更不是自尊、自爱、自强。自信，不是自洽，更不是自轻、自毁，自大。拿着不是当理说，难道但凡赚到钱了就是正义就是值得学习和模仿的吗？那还读什么书，上什么学，谈什么理想追什么梦，夜夜陪酒钱也不少赚等等言论就出来了。这些刚好被别有用心者利用搅乱正确价值观。比如，物质攀比炫富女、权利攀附很自如、家产鸠占马大蓉，这些都是极有害的，进入到这个思维里早晚会出事。,1,0,0,2023-11-17 22:50:32
    给你一个去董明珠身边学习的机会，你会不会去？？  王OK无非就是拍马屁拍的太明显了。。,1,0,0,2023-11-17 21:50:52
质疑波波，理解波波，成为波波,-1,0,0,2023-11-17 20:31:57
哈哈，王自如我倒不觉得他说了假话，他说的应该是他这个阶段这个处境说出来的相对正常的话。只是他的用词总还是太夸张，让人感觉到有点不舒服，就是说舔可以，但是你不能舔的哗哗响。王自如说不定心里真是那么想的，能够和董大姐这种时代风云人物呆一起，总还是能够学到一点东西的，董大姐之所以能够有今天的江湖地位，那没两把刷子那铁定是办不到的。当然学东西是一方面，在学习的过程中也会和董大姐熟悉起来，董大姐的资源，董大姐的人脉，董大姐的关照这些就都水到渠成了。既能近距离学习牛逼人物，又能和牛逼人物拉进关系，很多人都求之不得。只是恰好碰到采访，一下子太高兴，表达的太热烈了而已吧,1,0,0,2023-11-17 19:34:58
"想多了，多数岗位属于边缘人，哪怕你是985,211都是干活工具人。能靠拍马屁上位的已经处在一个不低的位置了，通常来讲你不配。公司找你就是干活的，干不好就滚。董明珠这些年都在向年轻主播递橄榄枝，这是决定性条件。",-1,0,0,2023-11-17 19:26:57
“我没有看过格力给我的工资条”废话，银行短信就看到了，谁看工资条。“能不能给我一间离你比较近的办公室，我要随时向您汇报”他的职位级别就注定了不能离老板办公室太远。“我哪怕每天什么事都不干，我就看她怎么开会，我听她每天讲什么、做什么，我都觉得是一件很幸福的事”渠道改革负责人，这个职位是要得罪人的，不借着大老板的虎皮，被你改革的对象谁鸟你？“刚毕业的年轻人一定要学会心态归零”唯一靠谱的话，除非真是包租公来体验生活的。懂了吧，他的职位注定了他只能依靠大老板，而在改革达成预期目标前，格力肯定会保他。至于改革完成后，他就是最好的背锅侠，曹操借头一用的典故都晓得伐？他最后这句归零的意思其实还有只要老板给够钱，他愿意心态归零当背锅侠的意思。现在懂了他为什么会说质疑/理解/成为他了吧。他很清楚他就是一个雇佣兵，资历能力关系都不够，德不配位，必然要玩点野路子。现在，目的达到咯。所谓舆论，不过他的工具而已，恭喜大部分回答的人，你们都被他利用了。,1,0,1,2023-11-17 18:14:28
掐指一算，自如双目三白，神色邪猥，黑气盈面，合该命中二十五岁和三十五岁上各有一次大劫，这不是应验了么。二十五岁上：雷军级别的大佬对你大加青眼抬抬手就是百十来万支持你的事业，罗永浩这样的年轻人圈层中的顶流毫不掩饰对你的偏爱付钱请你为他的新产品做测试提意见。两件快乐事情重合在一起，而这两份快乐，又给你带来更多的快乐。得到的，本该是像梦境一般幸福的时间……但是，为什么，会变成这样呢？三十五岁上：我这一生，如履薄冰。年少成名春风得意，靠着肯下力吃苦和几分小聪明，在江湖上早早立下字头，却一着不慎被老江湖老前辈出手废掉，沦为天下笑柄。那之后我再无豪情万丈只剩空空的行囊，是阿姨将我温柔安放为我抚平创伤。在道上普遍被优化被裁员的年岁我的位置依然稳如泰山，阿姨待我如此，我说几句提供情绪价值的话有错吗？有错吗？为什么，会变成这样呢……我应该是全网最早一批对王自如采访中怒舔董明珠这事发表评论的，当时就当个笑话看，不曾想这事越闹越大，止歇不住，对王自如来说俨然成了与老罗优酷约架后的二次全网社死事件。这么一看真有点感慨，自如命运坎坷啊，年轻时被老罗修理，中年了被群众看笑话，共同原因却出奇一致，就是因为做了缺乏底线的事。其实你别看现在人群口水汹汹，翻旧账看眼前都在嘲讽或训斥王自如有多么无耻；事实上，底线这个事是很虚的，人们在网上发表观点时是一套说辞，线下自己过生活时往往又是一种态度，概因看别人时思维智商占领高地、人格标准无比锋利，真把他放到具体情境中，他才会深刻感受到生活的复杂。这种复杂不是说面临一道黑白分明的选择题时迫于种种外在因素不知道选黑还是选白，而是生活本身就是暧昧无明的，身处其中时，可能由于种种盘算或侥幸心理或认知局限或信息不对称或是对后果无法预计，在预期如何抉择才对自己比较有利的推演中，你一不留神就滑向了你以为不可逾越的界线。说到底，缺乏底线这事，说严重也没那么严重，王自如面临的问题是，两次缺乏底线的行为都被动地拉到了聚光灯下进行审判。在眼下的公共讨论空间内，越来越追求一个初中生眼里的教科书式的洁版世界秩序，这样一套秩序也规定了我们讨论问题时哲学思辩、道德审视、文学素养和科技水平的认知上限，王自如缺乏人格尊严的跪舔式发言在这样的秩序中，无疑是值得鄙夷的；而由于又切中了就业形势严峻的职场话题，话题讨论的情绪基座足够厚重，加上王自如本人及其串起的罗永浩董明珠等有丰富的业界前史可供挖掘，更有许多咖位比较大的人纷纷投入了议论中，事件本身的热度就不断发酵到了超过其应有量级的水平。当然，这个事还有进一步挥发的空间。现在还有人在不断地对此事投入精力去搞评论创作，但是从职场打工人的角度已经说滥了，完全可以从董明珠与孟羽童和王自如两个员工的故事对比中寻找灵感，至于观点尽可自由发挥，这里只提示一点：这事其实看起来还蛮可以打打拳的，因为董明珠作为一个女性，一路拼杀站到了商业巨头权力结构的顶点，在用她的权力把一个男人塑造成伏低做小曲意逢迎的弄臣的同时，却不失慷慨地让孟羽童这样的女性藉由格力接班人的虚名作为阶梯自立门户自由飞翔展开自己的人生。你以为董总老江湖不知道用合同文书约束自己投入资源打造的网红品牌？她只是想让你看看，男人能够卑下猥琐到什么程度，女性可以自由舒展到何种境地……这么想想，是不是还挺带感的？,1,0,3,2023-11-17 18:08:12
如果欲望没那么高，其实并不用学他，91那先生做的好好的，极客湾也做的好好的。世界并不需要非黑即白，王自如只不过是能力和野心的不匹配，所以才会选择这种路线。如果能力和野心匹配，那就是极客湾、钟文泽。,1,1,11,2023-11-17 18:00:04
现如今，很多人对金钱的概念越发淡薄。就比如说，一百万和一千万，在网上的世界里，仿佛拥有百万身家与千万身家的差距也并不大。然而，实际上，这两者之间的差距犹如云泥之别。尤其是在净资产的情况下，一百万的净资产，即便按年利率3%来算，一年的收入也仅有3万；而一千万的净资产，同样的利率下，一年的收入却高达30万。倘若一个人拥有一千万的净资产，那么他的家庭主动收入至少为50万，否则他不可能积累下千万的家业，除非是借助时代的红利。这样看来，拥有百万净资产的人的收入明显低于拥有一千万净资产的人。因此，双方的生活质量也存在巨大的差距。如果将这种情况放到婚恋市场上，那么拥有百万净资产的男性要想找到一个普通的女性作为伴侣，他需要提供情绪价值。而拥有一千万净资产的男性，即使是在上海、北京这样的大城市，找一个普通的女性作为妻子，他并不需要提供情绪价值。,1,0,0,2023-11-17 17:25:53
我要纠正一点，「质疑他，理解他，成为他」中间漏了十分重要的一步：学习他。以前的我嗤之以鼻，现在的我逐帧学习。不然年轻人你真的以为理解他之后就能成为他了？,1,9,51,2023-11-17 16:11:57
666,0,0,1,2023-11-17 16:03:43
这是真的，因为社会资源越来越稀缺，逐步向少数人集中。再结合董明珠的过往经历和成就，有那么几个颇具事业心粉丝和迷弟不很正常？你粉一个女明星、女网红能获得什么？你粉一个世界五百强企业的董事长，一个国内外知名女企业家能获得什么？成年人都清楚。与其说王自如溜须拍马，倒不如说他打心眼里在粉董明珠，所以人家根本不在乎。年轻人总会变成中年人的，想要达到那样的境界，必然会成为那样的人，屁股决定脑袋，脑袋不变你就坐不稳。,-1,0,0,2023-11-17 12:59:02
最近格力王自如火了，年轻人嘲讽，中年人理解，职场老油条深刻赞同，仿佛只要身在职场，跪舔领导和对上管理是打工人过好日子的唯一宿命。但事实真的是这样么？我也不想讲大道理，所以分享一下我的个人职场经历，说不定能给各位带来一些启发。那年我刚毕业，以应届生的身份，加入了一家世界500强的省级公司，办公楼高大上，福利待遇远超同届，同事都是高学历人才。虽然这些对现在的我而言，早已不在乎，但对当时的我来说，那家公司几乎满足了对职场的全部幻想，但也是我噩梦的开始。老实说，当时的我就是个小菜鸟，什么都不懂，所以工作上经常会犯错，这点在职场上的都懂，如果你犯了错，除非这件事跟同事相关，不然即使他注意到了你的错误，也不会跟你说。所以我每次犯错，最后都是到了部门经理、甚至是总经理层面才会被发现。结果就是，我经常被经理拉到办公室里谈话，好在对方表面上很温柔，以致于每次被训后的我，不至于太难堪。也正因如此，我这里犯了一个很多新手都会犯的错误，那就是想多做一些工作，来补偿之前犯下的错误，但结果可想而知，因为能力不够，干的越多错的越多。不仅如此，周围同事看我这么积极，也会推一些脏活累活给我，干好了好处是他们的，干差了锅都是我背，导致我越想表现，在经理面前的印象越差，自己却苦的要命。所以作为一个职场新手，你一定要明白，在试用期期间，公司其实对你没有太多的期待，你可以产量少，但一定得把分内的活给干好干细，而不是图快做出一堆垃圾，结果反而容易被干掉。不过还好，我没有直接被干掉，但却被流放了，没错，就是字面意思。我这样折腾了两个月后，经理可能也受不了了，但奈何是她自己也刚上任，根基不稳，如果立刻裁人会影响部门的士气，所以她就找了借口，把我流放到一个偏远小县城，美其名曰锻炼，支援当地业务，也给我批了假。但实际上，当地根本就不缺人，尤其不缺我这种应届刚毕业、啥都不会的小白，至于经理这边，她也不下达任何具体的任务，也不告诉我什么时候可以回去。说白了，就是想让我知难而退，自己在试用期内主动申请离职，让部门的编制空出来。但我知道，如果我辞职就完了，第一份工作干两个月就跑路，没了应届生身份，根本找不到像样的工作，所以硬生生咬牙熬着，即使每天不知道干啥，也每天按时打卡上下班，不让经理抓住我一丝把柄。好在有两个资深同事看我可怜，一个劲的帮我说好话，才让我在熬了十来天后调回了省公司，恢复正常的工作。但作为一个小白，根本不懂职场中的各种道道，还是埋头做苦活、脏活、累活，累是很累，全部门加班也数我最多，但就我对部门的价值来说几乎是无，不仅如此，锅还背了不少。所以在年前，我的月度绩效一直不高，并且又被流放到了其他县城一次，全靠老同事看我弱小可怜，才帮我争了一点利益，不然我应该是熬不到过年。但这还不算完，因为在后面又发生了两件更噩梦的大事，让我意识到，如果再不保命，我可能在这个部门会被虐到连渣都不会剩。第一件大事是被主管背刺，当时我的主管是个公司资深老油条，从别的部门调来了的。新官上任，总要表现出亲和和善意，所以在上任的第一天，她就请我们全部门下馆子，表示自己以后就是我们这些专员的天，有事她来扛着，一定要为我们争取利益。表面上她确实做到了，每次我犯错，主管都说帮我求了情，分奖励方案的时候，也说帮我做了争取，我一度认为我的春天来了。后来发现全是扯淡，这个主管就是一个完完全全的两面人，在我面前说我干得不错，做得好，在经理面前，她几乎将全科室的屎盆子往我这个新人身上扣。而我因为缺少和经理直接沟通的机会，所以我一直真心实意感谢我的这位主管。但梦总有醒的一天，主管有次跟我透露自己受不了想辞职走人，还一直怂恿我这个干活最累，绩效最低的专员一起跑路。甚至有一次跟主管打电话时，她还真诚的向我保证，表示自己在这个行业工作这么多年，人脉还是有的，你辞职后一定帮我找好后路。你知道吗？我当时是真的信了，对主管的感激到达了巅峰。但我也没想到，梦会碎的那么快，过了半个月的样子，她换岗成功，我问她什么时候能帮帮我。她很冷血，说经理就是这样的，让我要么忍，要么滚。就是这么现实，她当初的承诺都是假的，只是想拉我下水，让部门人手短缺，给经理造成麻烦而已，一旦自己的诉求达成了，根本不管手下专员死活。那时的我，除了内心愤恨，委屈外，我不知道该怎么办，还好有两个老同事知道我辛苦，看我可怜护着我，不然唉......主管调动成功之后，我以为这件事就结束了，但这件事的余波，给我带来了第二个灾难，那就是年终奖的评定。上过班的都知道，部门里面一般要有个人背指标，这个指标一般都是休产假、新人来背。而我那个部门新人不少，其中还有个经常撂挑子不干活、到点走人的从其他分公司调来的新人，还有个休了小半年产假的专员。我以为这次我能顺利过关，给我个合格，但没想到，休产假的是经理的旧部下，那个新人可能有点背景，结果还是我背了指标。年终奖直接给打了个半折，未来几年我忘了，反正没有了调薪的机会。但问题是，总部在培训的时候，曾对我们上几乎千号应届生说过，新人第一年不能背指标，所以我去找了经理反映了这事。可部门经理的态度就是，反正我背指标这件事已经报上去了，改是不可能改的，让我明年努力‘摘帽’。当时的我真的是炸毛了，辛辛苦苦大半年，简直是一把辛酸泪，不过我心里也很清楚，如果我再不作出点改变，我肯定是一点机会都没有，再背一年指标，还得走人。尽管我后面才知道，这也是前主管的‘杰作’，整天背着我对经理坏话，所以才影响了经理的判断。但又能怎样呢？我就一小专员，还能斗得过老油条主管？因为有这半年的经历，我其实特别理解被群嘲的格力王自如，在职场，尤其是是大型职场，官大一级，能决定下面人的‘生死’，干得再多不如哄领导开心，让领导满意。所以趁着过年，我找了几本职场著作阅读，你还别说，效果还真的立竿见影。当然，书是一方面，另一方面是我真切的体验过苦难，所以能吸收书中的精华，如果职场一帆风顺或只是小磕小碰，读完这些书估计也没多大作用。依靠书的知识，我也成了职场里的‘王自如’，放下过往怨恨，不再背后说领导坏话反而维护领导，了解领导爱好，积极主动汇报，只做领导能看得见的、短期出效果的优质工作项目........总之，怎么让领导舒服就怎么来做，在职场里，我不是真正的我，而是一个圆滑求生存的人。也正是靠着这些技巧，在过完年的那三四个月里，我工作比之前轻松了至少一半不说，还月月拿最高绩效，一些好处我也能捞得着，顺带还能让同部门，不同科室的前主管吃瘪。两个字，很爽！但忠于一个领导最大的风险，就是领导倒台了，没错，我的领导在几个月后，被大领导流放到了下属三级公司，没熬几个月也被迫谢幕离开。而新来的领导，则很快对前任旧部进行清算，我则成了被清算对象，被迫主动辞职离场。职场真的很残酷，至于荧幕前狂捧董大姐的王自如，目前看上去确实滋润，但一旦董大姐退休或失势，王自如的未来的结果一定很惨。这么一看的话，跪舔领导，真的很难成为打工人的唯一出路，反倒是一条风险很大，且上限很低的职场生存方式。因为你的上限，就是你的领导，一旦跟错了领导，或领导换人，你的前途也就跟着废，甚至有些领导就像我的前任主管，是拿下属当垫脚石，用完即弃。至于想换个山头跟其他领导或换个公司？可别家领导/公司也要晋升，凭什么要晋升你这个‘外来户’？而你又能否保证，这个领导未来前途一定会好呢？这都很难说。另外还有一点，也是我感悟很深。就是领导也不是谁捧他，他都能看得上，你必须还得有能做事，挡事的能力，给领导提供相应的‘使用’价值，不然就算你把领导捧上天了，他都不会看你一眼。并且都是经过职场厮杀当上领导的人了，人家又不是傻，他也要做出业绩向上一级领导交，即使他是最大的领导，也得对公司业绩负责。所以你没能力，光会技巧也没用，所以很多人嘲讽王自如被‘包养’，从某种程度上来说是不公平的，因为王自如这个人实力还挺强的，在数码产品测评届，也曾混到过‘领袖’的地位，不亚于现在如日中天的何同学。只是没办法，尤其是在这个资源掌握在少数人手里的时代，你想快速发展，就只能折腰，但刚刚也说了，这么干短期回报确实高，但风险也非常大。所以在经历第一年‘地狱级’职场历练之后的我，也一直在思考，作为一个没有资源、没有背景而且还是文科专业毕业的我来说，未来的路到底该怎么走？走职场这条路，混口饭吃还行，但想跨越阶层对我来说肯定走不通，毕竟没有硬实力，就只能依附领导，而我的背景又决定了我的天花板很低，混到个中层就到头了，还得面临被干掉的风险。做生意？我这人又比较社恐，再加上我还有点读书人的清高，看不上甚至厌恶酒桌文化，不会拉关系，生意是肯定没法做的。我和别人能公平竞争的，只有时间，我比别人优秀一点的，就只有看的书多一点，想的问题深入一点，所以毫不夸张的说，自媒体写文章是我唯一跳出阶层的出路。一个人不内耗，也没有复杂的关系要处理，还能输出自己想表达的内容，甚至也没有职业天花板，同时也给了我生活上的底气，我不需要公司名头，我为自己自己背书。当然，每个人根据自己的特长、热爱，还可以做点别的事情，只要你做得好，带给别人价值，市场就会买单，只是这中间的过程快不了，只能慢工出细活，一步一个脚印。所以在我看来，跪舔领导，一定不是打工人的唯一的出路。打工人的出路，一定利用自己的技能与优势，对市场负责，对真心认可你的大众负责，且能摒弃浮躁的心态，这才是一个人在社会中一直屹立不倒的底气。最后，祝各位能找到属于自己的热爱。公众号：想说话的张凡,1,0,1,2023-11-17 12:50:11
我一般不看别人怎么说，只看他怎么做。后来，我发现，越是说漂亮话的，就得反着听！再后来，越是想让大多数人相信的道理，就越隐藏着别的目的。最后，我只相信那些失败经验，那比很多成功人士的经验，真诚的多！,1,0,0,2023-11-17 11:40:23
很多公司里，懂技术做研发的，不如会哄老板开心的混得好。这是因为开发产品的工程师，完成一个产品的研发之后，公司不需要他继续做新的产品了，或者是说他不能开发更多的产品了，那他的价值就下降了。他为公司提供的是“耐用品”，他做的一个产品，可以让公司使用几十年。而那些会哄老板开心的，今天哄老板开心了，明天又可以哄老板开心，源源不断地给老板提供“情绪价值”，他为老板提供是“消耗品”。老板今天用完之后，明天又需要他提供，所以老板变得离不开他。,1,0,1,2023-11-17 11:26:19
