除夕不放假，哈哈哈，笑死了。过年都不可以痛痛快快休息。我期待的下一个假期，就是过年了。无妨，没有就没有了。谁让现在穷呢？,0,0,0,2023-10-25 20:48:14
网民发了个球，前场一个大脚给了传说中的ZBJ守门员。那么问题来了，这一脚是传中还是射门？,1,0,2,2023-10-25 20:47:31
我现在支持各种地区的春节都可以申遗。春节不是可口可乐，全世界都一个味道,-1,0,5,2023-10-25 20:46:02
建议韩国将各节假日申遗我举双手赞成,-1,0,0,2023-10-25 20:42:03
除夕不放假，严重伤害了我的民族感情。,0,0,0,2023-10-25 20:41:32
大概10年代以前（具体哪年记不清了），春节假期都是默认从初一放到初七的。后来从某年开始，春节假期变成除夕到初六了，这下网上炸锅了，一片骂声：这不是侵占大家的隐形福利么？原来据骂人的网友说：除夕虽然不放假，但是很多公司单位都默认这一天比较松，可以早走甚至不来，即所谓隐形福利。现在除夕放假，但初七从本来放假变成上班，而实际操作中各家公司、单位不可能把初七当成除夕给大家隐形福利，所以假期这么安排是有问题的！所以你看，这个假期怎么安排都是横竖挨骂的事儿,1,9,67,2023-10-25 20:41:30
爆竹声中一岁除，春风送暖入屠苏。以前的孩子：什么是屠苏？现在的孩子：什么是爆竹？以后的孩子：什么是春节？,1,2,2,2023-10-25 20:40:55
反正到时候我不上班...不放假就请假我至少能做我自己的主。,0,0,0,2023-10-25 20:39:03
你说，春晚给谁看？,-1,0,0,2023-10-25 20:36:53
本来制定假期政策的专家的初衷是单位会自动在除夕放假，从而实现9天假期的效果，然而，这成为了道德绑架单位与员工的手段了：除夕，你放假还是不放假？可是有很多人盯着看呢！所以除夕放不放假将是朋友圈里的热点问题。,-1,1,0,2023-10-25 20:36:32
大家除夕给假日办找点事儿做吧。,1,0,0,2023-10-25 20:36:26
上了一天班，让我看到这个消息，我真的人麻了。,0,0,0,2023-10-25 20:35:45
什么叫伤害民族感情啊,1,0,0,2023-10-25 20:35:29
持续劣化营商环境，是唇亡齿寒的举措,1,0,0,2023-10-25 20:35:07
用心良苦啊！,-1,0,0,2023-10-25 20:34:56
放心。大年三十的不会让你们上班。上班的也是国企，央企，事业单位等。没规定放假不等于企业不放。,-1,2,0,2023-10-25 20:34:53
我想起来，之前看到还有人问现在为什么没年味了？真是讽刺啊,1,0,0,2023-10-25 20:34:45
好活,1,0,0,2023-10-25 20:34:30
除夕没有假？，神马神仙操作,1,0,0,2023-10-25 20:34:29
从根本上动摇了国人的传统观念这个能过审真的是有点匪夷所思了,-1,116,3611,2023-10-25 20:34:12
希望除夕不放假是真的不放假 别给我整个强行花公假休一天 我假期很宝贵的除此之外 说实在春节和现在工业化的中国有一点点关系吗 走亲戚 团圆饭 春节联欢晚会？你认真的？除了高铁买不到票我觉得不如正常双休,-1,0,0,2023-10-25 20:32:43
出生率这么低可能是因为畜生率太高了。,1,0,0,2023-10-25 20:32:26
除夕不放假，不伤害民族感情吗？,1,0,0,2023-10-25 20:31:39
就看公司接不接受鼓励了不知道年假能不能用,1,0,0,2023-10-25 20:31:31
活你们干，假我来休，不当人是吧,-1,0,0,2023-10-25 20:30:36
制定这个规则的人一定在想除夕去单位拿年货也算上班，多么的便民利民,1,0,0,2023-10-25 20:29:32
大年三十，大年三十，什么叫大年三十？,1,0,0,2023-10-25 20:28:11
除夕不放假，那就都调休或者请假啊，这样消费也有了，还不耽误生产   ,1,0,0,2023-10-25 20:28:03
白天不放假，自然没时间做年夜饭，晚上就只能去饭馆吃了。好一个如意的算盘。,-1,0,0,2023-10-25 20:26:50
自己不重视自己的节日，以后不要再说年味怎么淡了，都是被一步步逼的,1,1,104,2023-10-25 20:26:37
,-1,0,0,2023-10-25 20:26:00
这问题谁问谁死,-1,0,0,2023-10-25 20:25:12
还是年轻人太多了。8.90年代除夕的确不放假。,-1,0,0,2023-10-25 20:25:02
好羡慕韩国人的春节，韩国的传统文化还是赞 ,-1,0,17,2023-10-25 20:24:26
体现了优越的执政智慧  发动群众斗群众  将矛盾推给企业主和员工  堪称完美,-1,0,2,2023-10-25 20:23:47
怎么，你不服气,-1,0,0,2023-10-25 20:23:30
2003年2.1-7（大年初一至初七）2004年1.22-28（大年初一至初七）2005年2.9-15（大年初一至初七）2006年1.29-2.4（大年初一至初七）2007年2.18-24（大年初一至初七）2008年2.6-12（农历除夕至正月初六）直到2008年除夕才开始进入假期，还有没有人记得之前除夕是怎么过来的？这次调休安排真的挺好的，一是可以让员工看清楚自己的企业有没有人文关怀，二是可以让新时代的年轻人体验以前那种下班回家过年的浓浓年味。反正，除非全年放假365天，不管怎样调休或不调休都会有大把的人吐槽的。,1,0,4,2023-10-25 20:20:26
以后公司招聘广告福利待遇里面可以加上有带薪除夕假，增加了员工的幸福感和归属感，提升了公司的雇主形象。感谢国家改善营商环境（手动 ）,-1,0,0,2023-10-25 20:18:47
曾经你一手握着粮食，一手拿着理想；现在你糟蹋了粮食也捏碎了理想，明天呐？还有明天嘛,1,0,0,2023-10-25 20:18:17
大概设定放假时间的人都没家可回吧。,-1,0,0,2023-10-25 20:18:04
如何看待？让我们看看国家发改委是如何看待的首先大标题，除夕不放假是为了不让你们调休！更加人性化了！2024年春节至少放假8天，从初一放到初八，如果配合带薪休假可以放假9天，堪称新年第一份大礼包。(《108天！史上最长春节假期》2024年春节至少放八天，配合请假可以放假108天，堪称新年第一份大礼包！）虽然除夕当天名义上不放假，但鼓励各单位和机构根据实际情况来灵活安排。同时高速公路已经免费了，实质上就是创造条件给老百姓多放一天假。(话我已经放这里了，还不放假那就是你们的老板有问题。已经怪资本家了，可不能再怪我了哟！)春节假期的延长，能够满足广大群众有更多时间用于亲人团聚的心愿，还可以实现一个假期先团聚、后旅游的小目标。(除夕虽然没放假但是你们一定可以先团聚的对吧)这是在依据《全国年节及纪念日放假办法》规定的基础上的创新之举、暖心之举，充分体现出政策制定者的用心良苦和精心设计。(领导看我看我！我这马屁拍得响不响！)调休是放假安排中社会公众普遍关心的话题，是否调休以及如何调休，目前社会公众的观点差异比较大。(刁民竟敢有不同意见)总体而言，调休比不调休好，而且是不得不调。(我不要你觉得，我要我觉得！我说要调就要调)因为7个法定节假日中，春节、端午节和中秋节是按照农历来确定的，元旦节、劳动节和国庆节是按照公历来确定的，清明节又是按照节气来确定的，与公历历法中的双休日不够衔接，如果不做调休，基本上每年都会出现部分节假日与双休日之间间隔1个工作日、造成节假日“碎片化”等情况，形成很多“单蹦”，那就不是“累觉不爱”，而是“累且不爱”啦。(虽然今年清明放假没调休一片好评但是我不管！我说你们累你们就得累)调休就是在节假日总量固定的前提下，为避免节假日“碎片化”所做出的有效政策安排。(节假日太少了说出去没面子，让我来安排一点调休看上去假期多一点)2024年通过调休，形成了“9573”的放假时间安排，展现出较强的人性化和灵活性。(除夕让你们不能团圆展现了我大脑的人性化和灵活性！)2024年全年假期比较均衡，通过调借临近周末，春节至少8天、国庆7天、劳动节5天，元旦、清明、端午、中秋都是3天，长假后最长工作日也只有6天，调整的幅度比较小，避免出现长假过后工作时间长的局面，较好地满足了人们劳逸结合的实际需要。(最长只上六天！刁民还不谢恩。)国办发文中首次提出了鼓励结合落实带薪年休假等制度来落实，实质上就是倡导企事业单位在保障基本运行的前提下，能放则放。(我已经倡导过了，还不放可就不能怪我了哦！)我国现行法定节假日总天数为11天，周末休息104天，带薪休假5-15天，总假期天数在国际上处于中等偏上水平。(已经中等偏上了还想怎样？还不快给官老爷谢恩？刁民知足吧！没剥夺你们的周末就偷着乐吧。我是不会承认还有很多人过着大小周和单休的日子的，略略略)之所以大家仍然觉得假期不够、获得感不强，主要还是带薪年休假制度落实不到位，大家不能错怪法定节假日安排和调休了。(是资本家不当人，别再骂我了。)此次放假安排，通过鼓励用人单位将除夕放假纳入带薪年休假安排，就是一次非常巧妙的探索。(诶除夕我就是不放，把打工人和资本家放一起养蛊给官老爷我逗乐子，太巧妙啦)相对而言，带薪年休假的假期时间更长，安排更加灵活，更加适合人们错峰出行、分散安排的客观需要。只有将带薪年休假与法定节假日统筹协调安排好，劳动者的休息权利才会更有保障，保障得更为充分。(除夕没假放就是资本家不给你们放假，骂资本家，别骂我，你们的休息权利在资本家手上，找他们要保障去)邢伟 中国宏观经济研究院研究员(最后让我们记住这位大口吃屎还直呼屎香的研究员),0,1,16,2023-10-25 20:16:13
阴阳怪气的这么多，就是白送一天假啊，除夕放不放我不信有人上班！,-1,0,0,2023-10-25 20:15:04
棒子狂欢，话术都一样,-1,0,0,2023-10-25 20:14:21
你们悠着点，另外一个帖子已经不让按时间顺序查看了。,-1,1,0,2023-10-25 20:14:02
强烈建议大家除夕和春节那天连加两天班！让古今中外看看这所谓的盛世！,1,0,0,2023-10-25 20:12:19
我支持一天假也别放，取消双休，允许购房但只能住在厂里，取消所谓8小时工作制从物理的角度来讲，只要前进的速度够快，无论左转还是右转，合速度都近似于前进加油，冲吧！,-1,5,158,2023-10-25 20:11:20
2024年除夕不放假，一句“鼓励各单位结合带薪年假落实，安排员工除夕休息”，企业莫名成了“背锅侠”。我经过的企业，在往年，略微有些人性化管理的，遇到春节，大多会提前放个半天，让大家去买些年货。大家会觉得企业很有人情味儿，会有一颗感恩的心。对企业的认同感也会增强。2024年将打破这种企业和员工约定俗成的“小美好”了。因为，国家年度放假方案都白纸黑字鼓励单位统一安排带薪年假，安排除夕休息。如果企业还按照历年给大家“发福利”，在员工眼中将不再是“实惠”，而是不满，因为放少了。毕竟国家鼓励的是一天，你现在提前个半天或者几个小时，算什么呢？对企业而言就会面临尴尬，不放，是不响应国家号召，不懂得员工所需所想所念，不够人性。少放，又显得小气。放了，又变成了理所应当，没人会感激。可能还会遇到有些员工不想自己被“统筹安排”，而更想利用为数不多的年假做其他事情。总之，放与不放，调休与不调休，都是众口难调。国家统一安排出发点是好的，但时代变了，大众的需求和对消费的刺激，也不是单单靠调休成“小长假”就能得到满足的。根源在于，一年总的法定年假只有11天，总的时长不变，调休变成的长假就会慢慢成了一种拖累。毕竟休假后要面对的是“漫长”的上班。对于加班是常态的打工者而言，被调休而延长的工作日，宛如“人间炼狱”，一个字，苦！,-1,1,1,2023-10-25 20:11:04
还是那句话，你既然不敢不去，那就是该，真正有骨气的都是直接敢节假日走的，没骨气的才搁这抱怨。几年了，就是阗彀也有很多觉醒了，知道该怎么做了，你们倒是一点进步都没有啊。,1,0,2,2023-10-25 20:09:39
除夕不放假其实是好事，就是股民基民要麻烦点。大部分企业和公司，一般不会拖到最后一天才放假。大家想想每年春运，最早走的是进城务工人员（所谓的“农民工”），其次就是工厂的工人，工厂晚的也就腊月二十六七放假，早的可能过小年就放假了。大部分公司也不会拖到最后一天放假，就是今年除夕开盘，金融口的人有人要加班了。,1,0,0,2023-10-25 20:09:31
个人觉得还是突出一个（）特色市场经济劳动法这不是推行的不错？,1,5,6,2023-10-25 20:09:03
想不明白的是，现在确定放假时间都会这么多说明以及讨论，,-1,0,0,2023-10-25 20:08:30
除夕放什么假，那不是韩国的节日么 提现了社会主义的优越性呀,1,0,0,2023-10-25 20:07:41
只有韩国人申遗，或者需要转移人民视线的时候，它们才会装出一副特别关心传统文化的样子,-1,0,9,2023-10-25 20:07:30
后面不是有一句鼓励各单位结合xxx，让员工除夕放假吗？一般单位都给放吧。不放就辞职！md！,1,0,0,2023-10-25 20:07:00
这么多年过完小年开始一直到大年27左右.谁tm还做事啊！都是摸鱼！外地的同事多数都早回去过年了，我们本地的顶着，等他们回来补请我们吃年饭聚餐大家开开心心！以前到最后放假那天我住最近走路十分钟，默认就我一人一天值班到了5点直接去吃年饭同事们也都感谢我，那几天快过年了除了死人翻船谁会多事麻烦你？除夕不放假我觉得挺好，多休息一天反正除夕那几天本来就做不了什么事的,-1,0,0,2023-10-25 20:06:42
为什么上不了热榜？？？,-1,0,0,2023-10-25 20:06:15
朝天门的,1,0,0,2023-10-25 20:05:50
遥遥领先！,1,0,0,2023-10-25 20:04:49
哥们作为23届毕业生，工作后过的第一个春节。。就要除夕当天下午才下班???大年初一早上才能坐车回家??家里人都拜完年了，哥们下午才到家呢??,-1,0,0,2023-10-25 20:04:44
其实大可不必装作在乎我们，毕竟我们也不能真的把你们怎么样,1,0,10,2023-10-25 20:02:45
除夕不放假，背后的原因令人暖心T﹏T,0,1,1,2023-10-25 20:02:08
难受吗？难受又能怎样？,0,0,0,2023-10-25 20:01:53
政府人员：除夕下班回家，不误吃上热气腾腾的年夜饭，工作生活两不误，过年不忘抓生产，彰显我们社会主义制度的优越性。打工人：但是我们除夕还要上班，没时间准备年夜饭啊，下班桌子上也不会长出年夜饭呐？政府人员：啊？怎么可能！你们还要自己准备吗？你们家都没有保姆吗？怎么可能没钱，最不济把家里闲置的房子租出去一套就能请个保姆啊！,0,1,0,2023-10-25 20:00:23
在东亚这片土地上，你要相信，头脑最好用的人都在国家机关。他们不可能没想到现在这种情况的。以下是我的看法：1.他们是想要多给放假。正常都是大年三十到初六放假，一共放7天。现在初一到初七放假，迫使企业不按照国家法定节假日来执行，来提前去放这个假，实际放假天数大于7天。2.把压力甩给企业，鼓励企业去提前放假，让企业去抉择放或是不放。老谋深算。3.就是不给放，往死里干，过年别回去了，稳抓经济。回答比较片面，欢迎评论区讨论。,-1,0,1,2023-10-25 20:00:20
爱咋咋地吧，已经辞职躺平，每天都是放假在琢磨自由职业，有经验的大佬求带，感谢话说，研究怎么放假，这事有啥技术壁垒吗？我能干不 ,-1,0,0,2023-10-25 19:59:28
干脆过年也别放了，正常周末休息就行，真的很烦调休，连上七天,1,0,1,2023-10-25 19:57:59
首先，我坚决反对其次，我想我的话，会壮着胆子找老板商量，让我大年初一自己一个人出来加班都行，大年三十我请假。不给就缺勤一天，扣钱不差扣这一次了。,-1,0,0,2023-10-25 19:57:49
这要是放在法国……,-1,0,0,2023-10-25 19:57:25
就连头驴除夕那天都不用拉磨...,1,0,0,2023-10-25 19:57:24
中国人过年哪天最重要，当然是除夕，但是为什么除夕不放假还硬凑出8天。我感觉很多人没明白，目的就是想让你多放一天呗，毕竟企业有年休假。有调休，回家过除夕这个理由应该是无懈可击了吧。但是为什么大家吐槽，或许我理解是很多人正常的假期都得不到保证，就更别提年休假了。当然要是工作连正常的年休假都没有的话，估计消费能力也没有那么高，调休主要目的想促进消费，鼓励大家玩，那么大家是消费者嘛。可以带来充足的消费吗？要是分逼不花的话，给你放假有什么用，你哪天过年不行。,-1,0,0,2023-10-25 19:56:09
不放就不放呗，不是你自己作主不放的吗？,-1,0,0,2023-10-25 19:55:13
除夕不放假，没时间做年夜饭怎么办？买预制菜啊！要懂得他们的良苦用心！,1,0,0,2023-10-25 19:55:12
跟我没关系，病人不会因为在节假日不生病。我选择多加两个班赚点加班费。,1,0,1,2023-10-25 19:54:30
印度人口太多，把人都累死就不用解决退休问题了,-1,0,0,2023-10-25 19:54:24
我在想股市除夕夜来不来盘,-1,0,0,2023-10-25 19:53:49
以后如果国家规定清明节不放假，调后两天去祭祖我也不奇怪了,-1,0,0,2023-10-25 19:52:40
除夕那天，高速应该不会免费,0,0,0,2023-10-25 19:52:14
我国既有特色的调休放假制度远超国外搭桥放假制度，又有仅次于帕劳（一天年假）和坦桑尼亚（三天年假）的五天年假。另外建议明年国庆调休从29号放到11号这样不仅有13天长假，而且过完重阳就可以正常双休了。,-1,0,1,2023-10-25 19:52:08
鼓励除夕调休……何不食肉糜？,1,0,0,2023-10-25 19:52:02
从一青之后国庆节期间天安门的热闹程度就能看出来 老钟人就该这样对待 见的不能再见了,1,0,0,2023-10-25 19:50:34
很快就有一堆鸟开始为除夕不放假叫好了。,-1,0,0,2023-10-25 19:50:15
就地过年，免得城市萧条，开年失业率彪升,-1,0,1,2023-10-25 19:49:21
它要是不写最后一句，我还能以为它不知道那天是除夕,1,0,1,2023-10-25 19:49:13
还是太保守了，直接说配合15天年假可以放23天多好，这才是新年第一份大礼,-1,0,4,2023-10-25 19:47:20
拯救了春晚。除夕上一天班回来，谁还有精力吐槽春晚包不包饺子、生不生孩子。这个新闻给我的感觉是生气中带着点好笑。网络世界的群情激奋向来是时效性的、没有现实意义的，所以即使再无语，也就只能吐槽几句。无能为力，只能应应景儿。无数条新闻就这样成为旧闻，崭新的新闻又引来新的愤怒。周而复始。虽然过往这些年大家都吐槽越来越没有年味儿，都觉得春晚越办越垃圾，但对于过年回家，中国人有很深的情怀。过年最热闹的是年前，年后基本就是躺平休息，间或走走亲戚。除夕辞旧岁、吃年夜饭，对很多家庭来说是个很重要的仪式。除夕不放假，这种仪式感会慢慢被削弱。如果变成常态，以后这年过的也就没什么大意思。我不懂这一天假期到底差在哪儿，效益差的公司有这一天也不能起死回生，再能干的员工在这一天也干不了什么事情，图啥呢？有些公司年后开工特别早，根本不会等到初八。它们顾及员工情绪，以往可能只敢在年后的假期里做做手脚，现在除夕不用放假了，还不往死里薅...,0,0,5,2023-10-25 19:47:13
能坚持到最后一天还上班的都是好单位，员工大部分是本地人，除夕当天下午提前半天溜号，不会有人较真的。按天结工资的，提前半个月就回老家了，没走的人家就没打算回家过年。,-1,0,1,2023-10-25 19:47:07
这就是你们不对了，除夕鼓励放假，之后给你放八天历史上绝无仅有，另外交通部直接高速免费9天，对于996都是福报的你们怎么敢这么挑剔？说到底还是发展中国家，人均收入还很低，不奋斗怎么实现现代化，我就佩服有些人真是蜜罐里长大的，我们小时候，那时候大人们只休息一天的，忙的脚打后脑勺，日子过得依然甜蜜，都是好日子给的太快了，有什么资格端起碗来吃肉，放下筷子骂娘，好好干活吧，一天不给你休，你自己也得找饭辙，国家不欠你的，父母更不欠你的，要知足常乐！,-1,0,1,2023-10-25 19:45:21
很难想象都这样了还会有人无条件地全面爱国。,1,1,2,2023-10-25 19:45:01
放假本质上是让你们消费的，不是让你们团圆的…这么一想除夕不放假是不是合理多了 ,1,0,0,2023-10-25 19:44:52
作为一个普通私企的打工者，我相信我们公司会按照往常的习惯放假，起码除夕这天不会让我们上班。如果我们这个小公司的老板格局还不如这些除夕不放假的决策者和推动者们高的话，那这个波一班儿不上也罢。,1,0,0,2023-10-25 19:44:07
欧洲都有除夕这一天的假，中国没有是吧？,1,0,4,2023-10-25 19:42:30
这下除夕真的只是韩国人的节日了,1,0,4,2023-10-25 19:42:29
在知乎超能力话题下讨论的各位：你们化身祖国人后，第一个要去的地方，第一批要找的人，第一件要改变的事情，明确了吗？唉，真期盼有我们的英雄,-1,0,0,2023-10-25 19:41:46
"我对这事持非常乐观的态度 原因大概有以下几点 1) 这不是第一次年30不放假 ,却是第一次在文件中写明了""鼓励各单位结合带薪年休假等制度落实，安排职工在除夕（2月9日）休息"" 2) 国家在有意的压制内卷文化 ,放7天(包括年30)和放8天(不包括年30)明显后者在舆论上更不合理3) 国家在国庆的8天假期里尝到了甜头 国庆8天有力的促进了消费复苏和经济增长4) 在目前的宣传口径中""年假"",""除夕""占据了非常重要的版面 ,这太高调了 像是有意为之.5)国家在发展 ,法制在完善,人民的需求也在不断的提高,这些是不争的事实.年假制度不可能一直名存实亡 ,一定会通过某种方式实现 这次就是一个很好的开始.基于以上几点 我做如下推论 1)国家层面上 ""鼓励""以半强制的形式进行 ,除夕大部分普通人还是放假了的2) 春节期间各大媒体榜单都是""XX除夕不放假"" 一些头铁的单位被挂在热榜来回鞭尸3) 以此为契机,年假制度在缓慢,艰难 曲折中不断前进.10.25 立贴于此",-1,0,0,2023-10-25 19:40:50
如果不满意的话可以看看我国港澳台地区的放假和年假安排台湾（总17~44天）法定节假日 14天年假 3天（工作0.5~1年）         7天（工作1+年）        10天（工作2+年）        14天（工作3+年）        15天（工作5+年）+1天/每+1年       （最多 30 天） 香港（23~30天）法定节假日 16天年假 7天（工作2+年） +1天/每+1年         14天（工作9+年）澳门（21~24天）法定节假日 18天 (周末的假期将工作日作为休息日代替。)年假 3天（工作3+月）         6天（工作1+年）而我们总共有16~26天（今年14~24天）假呢，还有啥不满意的,-1,0,1,2023-10-25 19:40:34
“你在睡觉的时候，美国人都在工作。”,1,0,1,2023-10-25 19:40:28
好，威武，支持，有希望,-1,0,0,2023-10-25 19:39:09
这还不感恩？说明关心大家的身体，不然还得吐槽加班没有加班费，伤到肠胃专家该多心疼啊,1,0,0,2023-10-25 19:39:01
我是用手机看的,-1,0,0,2023-10-25 19:38:19
